city,year,page,line_no,organization_name,category,sub_category,line,address,description
Lansing,1894,7367228,3,Owosso Union No. 167,Labor Organizations,,"Cigarmakers' Union.--Harry Haylock collector at Lansing for Owosso Union No. 167, 312 Franklin east.",,
Lansing,1894,7367228,4,Council of Trades and Labor Unions.,Civic Organizations,,"Council of Trades and Labor Unions. - Meets first and third Tuesdays of each month at Union Labor Hall. J. G. Gross, President; Wm. Ferris, Vice President; G. В. Cole, Recording Secretary; E. McAfee, Financial Secre- tary; Wm. Moore, Treasurer.",,
Lansing,1894,7367228,5,Iron Molders' Union No. 225.,Labor Organizations,,"Iron Molders' Union No. 225. - Meets first and third Tues- day of each month at Union Labor Hall. Mark Knight, President; Joseph Daily, Vice President; Chas. Mc- Mahon, Recording Secretary; J. Gross, Corresponding and Financial Secretary; Jos. Hoffman, Treasurer.",,
Lansing,1894,7367228,6,Journeymen Barbers' Union No. 9.,Labor Organizations,,"Journeymen Barbers' Union No. 9. -Meets second and fourth Tuesday of each month at Union Labor Hall. J. A. F. Bell, President; G. M. Valentine, Vice President; Bert Renwick, Treasurer; A. N. Sice, Corresponding Secretary; Richard Rose, Financial Secretary.",,
Lansing,1894,7367228,7,Lansing Printing Pressmen's Union No. 12.,Labor Organizations,,"Lansing Printing Pressmen's Union No. 12.-Meets first Monday after last Saturday of each month. John Bates, President; C. F. Hoffman, Vice President; B. S. Har- rison, Recording Secretary; George Renner, Secretary and Treasurer.",,
Lansing,1894,7367228,8,Lansing Typographical Union No. 72.,Labor Organizations,,"Lansing Typographical Union No. 72. - Meets last Saturday of each month at Union Labor Hall. R. W. Cooper, President; Wm. J. Goodspeed, Vice President; S. N. Chilton, Financial Secretary; Clement Strang, Record- ing Secretary; Fay Strickland, Treasurer.",,
Lansing,1894,7367228,9,Machine Woodworkers' Union No. 69.,Labor Organizations,,"Machine Woodworkers' Union No. 69. -Meets Monday even- ings at Union Labor Hall. E. P. Cole, President; E. D. Cole, Secretary.",,
Lansing,1894,7367228,10,Machinists' Union No. 384.,Labor Organizations,,"Machinists' Union No. 384. - Meets second and fourth Thurs- day of each month at Union Labor Hall. Chas. Thurs- ton, Master Machinist; Geo. Horan, Foreman; E. M. Smith, Treasurer; Wm. Ferris, Recording Secretary.",,
Lansing,1894,7367229,2,Retail Clerk's Protective Association,Benevolent and Fraternal,,"Retail Clerk's Protective Association No. 5228.-Meets second and fourth Tuesdays of each month at Union Labor Hall. Walter Hazen, President; Miss Etta Manne, Vice President; S. O. Wells, Treasurer; Miss Celia Everett, Financial Secretary; E. M. Higgs, Recording Secretary.",,
Lansing,1894,7367229,3,Team Owners' Union,Labor Organizations,,"Team Owners' Union, No. 6,342.-Meets every Tuesday evening at A. O. U. W. hall. Wm. Maroney, President; Chas. Johnson, Vice President; James Hendricks, Recording Secretary; Charles Williams, Financial Secretary; A. B. Morse, Treasurer; James Maroney, Guide; Lorin Dunlap, Doorkeeper.",,
Lansing,1894,7367229,4,Capital Grange,Civic Organizations,,"Capital Grange, No. 540.-Meets every Saturday evening at their hall, 744 Turner, North Lansing, at 7 P. M. winter, and 7:30 P. M. summer. E. A. Holden, Master; O. С. Wheeler, Secretary; E. E. West, Overseer; K. L. But- terfield, Lecturer; H. C. Everett, Treasurer.",,
Lansing,1894,7367229,5,Catholic Mutual Benefit Association,Benevolent and Fraternal,,"Catholic Mutual Benefit Association, St. Mary's Branch, No. 18.-Meets first Thursday in each month. Rev. Fr. Slattery, spiritual advisor; Michael Meloy, Chancellor; George Cook, President; Joseph Boichot, Vice Presi- dent; J. A. Reck, Recording Secretary and Treasurer; Frank F. Reck, Financial Secretary.",,
Lansing,1894,7367229,6,Central District Homœopathic Society,Miscellaneous,,"Central District Homœopathic Society.-Meets in Lansing four times a year. D. M. Nottingham, President; C. M. Watson, Secretary.",,
Lansing,1894,7367229,7,Einigkeit Lodge,Secret Societies,,"Einigkeit Lodge, D. O. H., No. 575.- Meets first and third Wednesday of each month at Red Men's Hall. Jos. Reuffer, O. B.; C. Glukowsky, U. B.; C. Hoppe, Ex. B.; E. Oetiker, Secretary; Ch. Foerster, Treasurer; P. Rich- ter, Financial Secretary.",,
Lansing,1894,7367229,8,Federal Council of the Christian Churches of Lansing,Churches,,"Federal Council of the Christian Churches of Lansing.- Meets first Monday of each month at St. Paul's Parish Rooms. Rev. W. H. Osborne, President; P. H. Dolan, Secretary.",,
Lansing,1894,7367229,9,German Workingmen's Aid Society,Benevolent and Fraternal,,"German Workingmen's Aid Society.-Meets third Sunday of each month at their hall on Grand, near Saginaw. Christ Prost, President; Chas. Mahler, Recording Secre- tary; Jacob Seigrist, Financial Secretary; Fred Vollmer, Treasurer.",,
Lansing,1894,7367229,10,Grand River Boat Club,Clubs,,Grand River Boat Club.-Club rooms northwest corner Washington avenue and Kalamazoo. Boat house foot of,,
Lansing,1894,7367230,2,Lansing Lodge J. O. A. M.,Benevolent and Fraternal,,"Lansing Lodge J. O. A. M.-Meets every Tuesday evening at I. O. G. T. Hall. Benj. Mann, C.; Chas. Hoffman, P. C.; Fred Houghton, V. C.; Samuel Bennett, Secre- tary; J. Frank Strong, Financial Secretary; Chas. Clark, Treasurer.",,
Lansing,1894,7367230,3,Ladies' Literary Society,Clubs,,"Ladies' Literary Society. - Meets semi-monthly. Mrs. Henry Howard, President; Mrs. E. B. Carrier, Vice President; Mrs. Harris Thomas, Secretary; Mrs. A. A. Wilbur, Treasurer.",,
Lansing,1894,7367230,4,Lansing Bicycle Club,Clubs,,"Lansing Bicycle Club. - Meets first and third Tuesdays of each month at the office of E. A. Bowd. E. A. Bowd, President; H. B. Morgan, Secretary and Treasurer; H. M. Verplank, Captain; Ira Hatch, Sergeant.",,
Lansing,1894,7367230,5,Lansing Camera Club,Clubs,,"Lansing Camera Club. -Meets every Friday evening in club rooms in city hall block. President, S. S. Riley; Vice President, J. N. Mutton; Secretary, C. C. Collins; Treas- urer, F. W. Curran.",,
Lansing,1894,7367230,6,Lansing Humane Society,Clubs,,"Lansing Humane Society. - Meet on call of President or Sec- retary. B. F. Hall, President; S. L. Kilbourne, Vice President; Dr. J. A. Marvin, Secretary; M. L. Coleman, Treasurer.",,
Lansing,1894,7367230,7,Lansing Industrial Aid Society,Benevolent and Fraternal,,"Lansing Industrial Aid Society. -Meets second Tuesday of each month at Society's building, 119 Shiawasse east. Mrs. N. B. Jones, President; Dr. L. Anna Ballard, Vice President; Mrs. T. W. Westcott, Secretary; Chas. H. Osband, Treasurer.",,
Lansing,1894,7367230,8,Lansing Liederkranz,Clubs,,"Lansing Liederkranz. - Meets at their hall on Grand, foot of Lapeer, first Sunday in each month; meet for singing Mondays and Thursdays of each week. Frederich Vol- Imer, President; Christian Ziegler, Financial Secretary; Martin Lichte, Treasurer; Charles Guenther, Recording Secretary.",,
Lansing,1894,7367230,9,Lansing Ministerial Association,Clubs,,"Lansing Ministerial Association. - Meets first Monday of every month at Universalist Parish House. Rev. Wm. Ewing, President; Rev. Charles Legal, Secretary and Treasurer.",,
Lansing,1894,7367230,10,Lansing Rod and Gun Club,Clubs,,"Lansing Rod and Gun Club. - Meets Wednesday afternoons at State Fair Grounds for shooting. E. F. Cooley, Presi- dent; B. F. Hall, Vice President; J. E. Nichols, Secre- tary; C. J. Davis, Treasurer; C. Schelling, Captain; C",,
Lansing,1894,7367231,3,Lansing Woman's Club,Youth Organizations,,"Lansing Woman's Club. -Meets every Friday at 2:30 P. M. at their hall, 110 Ottawa west. Mrs. Dr. Ranney, President; Mrs. J. H. Wardwell, Vice President; Mrs. M. W. Howard, Corresponding Secretary; Mrs. Ella Shank, Recording Secretary; Miss Jennie Green, Treasurer.",,
Lansing,1894,7367231,4,Michigan State Agricultural Society,Civic Organizations,,"Michigan State Agricultural Society. - Wm. Ball, Hamburg, President; G. W. Bement, Lansing, Vice President; C. W. Young, Paw Paw, Treasurer; I. H. Butterfield, Lansing, Secretary.",,
Lansing,1894,7367231,5,Michigan State Bar Association,Civic Organizations,,"Michigan State Bar Association. - M. V. Montgomery, President; O'Brien J. Atkinson, Port Huron, Vice President; Eli R. Sutton, Detroit, Secretary; Arthur C. Denison, Grand Rapids, Treasurer.",,
Lansing,1894,7367231,6,Michigan State Millers' Association,Civic Organizations,,"Michigan State Millers' Association.-W. A. Coombs, President, Coldwater; R. T. French, Vice President, Middle- ville; M. A. Reynolds, Secretary and Treasurer, Lansing.",,
Lansing,1894,7367231,7,Odd Fellows' Mutual Benefit Association,Benevolent and Fraternal,,"Odd Fellows' Mutual Benefit Association. - Hollister Build- ing. Andrew Harshaw, President; John Northwood, Vice President; E. S. Andrews, Secretary; B. D. Pritch- ard, Treasurer; C. H. Haskin, Medical Director.",,
Lansing,1894,7367231,8,Turner Hall Association,Civic Organizations,,"Turner Hall Association. - Meets second Sunday of each month at 3 P. M., and also Tuesdays and Fridays of each week at 7:30 P. M. J. C. Wolf, President; Emil Arndt, Vice President; P. F. Richter, Secretary; Christian Vogel, Treasurer.",,
Lansing,1894,7367231,9,W. C. T. U.,Benevolent and Fraternal,,"W. C. T. U.- Meets every Thursday at 3 P. M. at Y. W. C. A. rooms. Mrs. G. R. Malone, President; Mrs. C. J. Strang, Recording Secretary; Mrs. Alfred Wise, Treas- urer.",,
Lansing,1894,7367231,10,Lathrop W. C. T. U.,Benevolent and Fraternal,,"Lathrop W. C. T. U. - Meets every other Tuesday. Mrs. Helen Case Adams, President; Mrs. J. M. Wood, Vice President; Mrs. M. McNeal, Recording Secretary; Mrs. Jennie McNeal, Assistant Recording Secretary; Mrs. B. Webber, Corresponding Secretary; Miss H. I. Webber, Treasurer.",,
Lansing,1894,7367231,11,Y. W. C. A.,Youth Organizations,,"Y. W. C. A.- Meets at their rooms, 120 Ottawa west, every Sunday at 4 Р. М. Miss Emily Cook, President; Miss Emily Barnard, Recording Secretary; Dr. L. Anna Bal- lard, Corresponding Secretary; Miss Fanny Blair, Treas- urer.",,
Lansing,1894,7367232,1,First Baptist Church Society,Churches,,"Baptist Visitor The (Religious, monthly)-Published by First Baptist Church Society.",,
Lansing,1894,7367232,2,Mrs. S. E. V. Emery,Uncategorized,,"Corner Stone The (Temperance, monthly)-Mrs. S. E. V. Emery, editor, 514 Seymour.",,
Lansing,1894,7367232,3,Kenyon Butterfield,Uncategorized,,"Grange Visitor (Neutral, semi-monthly) Kenyon Butterfield, Editor, 204 Washington avenue south.",,
Lansing,1894,7367232,4,L. E. Rowley,Uncategorized,,"Lansing Journal The (Democratic, daily and weekly)-L. E. Rowley, Editor; 115 Ottawa east.",,
Lansing,1894,7367232,5,Henry R. Pattengill,Uncategorized,,"Michigan School Moderator (Educational, semi-monthly)- Henry R. Pattengill, Editor; 420 Townsend.",,
Lansing,1894,7367232,6,T. S. Hoyne,Uncategorized,,"Medical Visitor The (Medical, monthly). Publication office 116 Michigan avenue west. T. S. Hoyne, M. D., editor; 1833 Indiana avenue, Chicago, Ill.",,
Lansing,1894,7367232,7,E. J. Baumann,Uncategorized,,"Michigan Staats Zeitung (weekly)-E. J. Baumann, Propri- etor; 117 Michigan avenue west.",,
Lansing,1894,7367232,8,C. G. Bailey,Uncategorized,,"North Lansing Record (weekly)-C. G. Bailey, Editor and Proprietor; Warner block.",,
Lansing,1894,7367232,9,Marcus Petersen,Benevolent and Fraternal,,"Northern Light The (Fraternal, monthly)-Marcus Petersen, Editor and Publisher: 500 Genesee west.",,
Lansing,1894,7367232,10,D. D. McArthur,Civic Organizations,,"Speculum The (monthly)-Published by M. A. C. Students' Association; D. D. McArthur, Editor-in-chief; Agricul- tural College.",,
Lansing,1894,7367232,11,Lewis M. Miller,Uncategorized,,"State Affairs (monthly)-Lewis M. Miller, Editor; 207 Grand south.",,
Lansing,1894,7367232,12,C. A. White,Uncategorized,,"State Democrat The (Democratic, weekly)-C. A. White, Editor and Proprietor; 114 Ottawa east.",,
Lansing,1894,7367232,13,Darius D. Thorp,Uncategorized,,"State Republican (Republican, daily and weekly)-Darius D. Thorp, Proprietor; 114 Michigan avenue west.",,
Lansing,1894,7367233,1,CHILSON & McKINLEY'S,Uncategorized,,"CHILSON & McKINLEY'S Barnes' Flats, east side Capitol avenue between Allegan and Washtenaw.",,
Lansing,1894,7367233,2,Buck's Block,Uncategorized,,"Buck's Block, 301-303 Washington avenue north.",,
Lansing,1894,7367233,3,Butler Block,Uncategorized,,"Butler Block, northwest corner Washington avenue and Kalamazoo.",,
Lansing,1894,7367233,4,City Hall,Uncategorized,,"City Hall, south side Michigan avenue between Washington avenue and Grand.",,
Lansing,1894,7367233,5,Prince's Band Hall,Miscellaneous,,"Prince's Band Hall, north side Franklin between Turner and Cedar.",,
Lansing,1894,7367233,6,Foresters' Hall,Benevolent and Fraternal,,"Foresters' Hall, 106 Washington avenue south.",,
Lansing,1894,7367233,7,G. A. R. Hall,Patriotic Organizations,,"G. A. R. Hall, 321 Washington avenue north.",,
Lansing,1894,7367233,8,Good Templars' Hall,Secret Societies,,"Good Templars' Hall, 107 Washington avenue south.",,
Lansing,1894,7367233,9,Government Building,Uncategorized,,"Government Building, northeast corner Capitol and Michi- gan avenues.",,
Lansing,1894,7367233,10,Grange Hall,Uncategorized,,"Grange Hall, southeast corner Clinton and Turner.",,
Lansing,1894,7367233,11,Hollister Block,Uncategorized,,"Hollister Block, northwest corner Washington avenue and Allegan.",,
Lansing,1894,7367233,12,I. O. O. F. Hall,Benevolent and Fraternal,,"I. O. O. F. Hall, 213 Washington avenue north.",,
Lansing,1894,7367233,13,Industrial School for Boys,Welfare Organizations,,"Industrial School for Boys, east end Shiawassee.",,
Lansing,1894,7367233,14,Ingersoll Block,Uncategorized,,"Ingersoll Block, southwest corner of Grand and Allegan.",,
Lansing,1894,7367233,15,Jerome Block,Uncategorized,,"Jerome Block, 108 Michigan avenue west.",,
Lansing,1894,7367233,16,K. of P. Hall,Secret Societies,,"K. of P. Hall, 215 Washington avenue north.",,
Lansing,1894,7367233,17,Lansing Industrial Aid Society's Building,Welfare Organizations,,"Lansing Industrial Aid Society's Building, 119 Shiawassee east.",,
Lansing,1894,7367233,18,Lansing Liederkranz Hall,Clubs,,"Lansing Liederkranz Hall, east side Grand, foot of Lapeer.",,
Lansing,1894,7367233,19,McClure Block,Uncategorized,,"McClure Block, 112-114 Washington avenue south.",,
Lansing,1894,7367233,20,Maccabee Hall,Benevolent and Fraternal,,"Maccabee Hall, 401-405 Washington avenue north.",,
Lansing,1894,7367233,21,Masonic Hall,Secret Societies,,"Masonic Hall, 100 Washington avenue south.",,
Lansing,1894,7367233,22,Mead's Hall,Uncategorized,,"Mead's Hall, southeast corner Washington avenue and Ottawa.",,
Lansing,1894,7367233,23,Michigan School for the Blind,Welfare Organizations,,"Michigan School for the Blind, west end Franklin.",,
Lansing,1894,7367233,24,Michigan State Agricultural Society's Fair Grounds,Civic Organizations,,"Michigan State Agricultural Society's Fair Grounds, south end Division.",,
Lansing,1894,7367233,25,Old State Building,Uncategorized,,"Old State Building, southwest corner Washington avenue and Allegan.",,
Lansing,1894,7367233,26,Opera House Block,Uncategorized,,"Opera House Block, southwest corner Washington avenue and Ionia.",,
Lansing,1894,7367233,27,Old Postoffice Building,Uncategorized,,"Old Postoffice Building, 200-202 Washington avenue north.",,
Lansing,1894,7367233,28,Rice's Hall,Uncategorized,,"Rice's Hall, 227 Washington avenue north.",,
Lansing,1894,7367233,29,Schneider Block,Uncategorized,,"Schneider Block, 222 to 224 Washington avenue north.",,
Lansing,1894,7367233,30,Smith Block,Uncategorized,,"Smith Block, west side Washington avenue between Allegan and Washtenaw.",,
Lansing,1894,7367233,31,Stahl Block,Uncategorized,,"Stahl Block, 213 Washington avenue north.",,
Lansing,1894,7367233,32,State Agricultural College,Uncategorized,,"State Agricultural College, Michigan avenue three miles east.",,
Lansing,1894,7367234,2,Turner Hall,Benevolent and Fraternal,,"Turner Hall, 414 Grand north.",,
Lansing,1894,7367234,3,Union Labor Hall,Labor Organizations,,"Union Labor Hall, 319 Washington avenue north.",,
Lansing,1894,7367234,4,Universalist Parish House,Churches,,"Universalist Parish House, se cor Washington ave and Ot- tawa.",,
Lansing,1894,7367234,5,Whitney Block,Uncategorized,,"Whitney Block, southwest corner Washington and Michigan avenues.",,
Lansing,1894,7367234,6,Chicago & Grand Trunk Railway-Passenger station,Uncategorized,,"Chicago & Grand Trunk Railway-Passenger station corner Washington avenue and South. Frederick Green, Agent.",,
Lansing,1894,7367234,7,"Detroit, Lansing & Northern Railroad-Passenger station",Uncategorized,,"Detroit, Lansing & Northern Railroad-Passenger station, East between Michigan avenue and Shiawassee. Frank Townsend, Agent.",,
Lansing,1894,7367234,8,Lake Shore & Michigan Southern Railroad (Lansing Branch),Uncategorized,,"Lake Shore & Michigan Southern Railroad (Lansing Branch) -Passenger station, foot of Condit. North Lansing station, East between Turner and Center. George Mack, Agent.",,
Lansing,1894,7367234,9,Michigan Central Railroad (Saginaw Division),Uncategorized,,"Michigan Central Railroad (Saginaw Division)-Passenger station and Freight depot, East between Michigan ave- nue and Shiawassee. Charles E. Mercer, Ticket Agent. Oscar Waters, Freight Agent.",,
Lansing,1894,7367234,10,"Lansing Lodge No. 33, F. & A. M.",Benevolent and Fraternal,,"Lansing Lodge No. 33, F. & A. M.-Regular meeting, Monday evening of each month, on or before full moon, at Masonic Hall. Wm. T Hebbard, W. M.; Jacob Ferle, S. W.; Earl M. Norton, J. W.; John H. Chase, Secretary; L. V. E. Ihle, Treasurer; O. C. Leggett, S. D.; J. A. Hamilton, J. D.; Ira McKeen, Tiler.",,
Lansing,1894,7367234,11,"Capitol Lodge of S. O., No. 66, F. & A. M.",Benevolent and Fraternal,,"Capitol Lodge of S. O., No. 66, F. & A. M.--Regular meet- ing Wednesday evening of each month on or before full moon, at Masonic Hall. John P. Sandford, W. M.; Hiram W. Rikerd, S. W.; G. Walter Meade, J. W.; Wm. Longstreet, Treasurer; Eli Bidelman, Secretary; C. H. Dunker, Tiler.",,
Lansing,1894,7367234,12,"Capitol Chapter No. 9, R. A. M.",Benevolent and Fraternal,,"Capitol Chapter No. 9, R. A. M. - Meets Tuesday evening of each month on or before full moon, at Masonic Hall.",,
Lansing,1894,7367235,1,CHILSON & McKINLEY'S,Uncategorized,,CHILSON & McKINLEY'S,,
Lansing,1894,7367235,3,Lansing Council No. 29,Secret Societies,,"Lansing Council No. 29, R. & S. M.-Meets Thursday evening of each month after full moon, at Masonic Hall. M. B. Carpenter, T. I. M.; Ed. Graham, D. M.; Josiah Bruno, P. C. of W.; E. W. Dart, Treasurer; C. P. Ten Eyck, Recorder.",,
Lansing,1894,7367235,4,Lansing Commandery No. 25,Secret Societies,,"Lansing Commandery No. 25, K. T.-Meets second Friday evening of each month, at Masonic Hall. John T. Page, E. C.; J. Edward Roe, G.; E. M. Slayton, C. G.; George A. Hasty, P.; C. M.. Norton, S. W.; Frank Gardner, J. W.; M. D. Chatterton, Treasurer; George Green, Recorder; John Sayers, S. B.; E. H. Porter, S. B.; G. Walter Meade, W.; Horace Parsons, Sentinel.",,
Lansing,1894,7367235,5,Arbutus Chapter No. 45,Secret Societies,,"Arbutus Chapter No. 45, Order of Eastern Star. - Meets at Masonic Hall first Saturday evening of each month. Mrs. G. H. Saxton, W. M.; G. H. Saxton, W. P.; Mrs. Wm. Rice, A. M.; Mrs. Q. A. Smith, Treasurer; Mrs. F. L. Gardner, Secretary.",,
Lansing,1894,7367235,6,Capitol Lodge No. 8,Secret Societies,,"Capitol Lodge No. 8, F. & A. M. (colored). -Meets every Tuesday evening at 107 Washington avenue north. Geo. W. Henderson, W. M.; Andrew Dungey, S. W.; Llewellyn Pierce, J. W.; Arthur Haithcock, Secretary; Harrison Trent, Treasurer; Geo. Valentine, S. D.; Chas. Jackson, J. D.; J. D. Scott, Tiler.",,
Lansing,1894,7367235,9,Lansing Grand Lodge of Perfection,Secret Societies,,"Lansing Grand Lodge of Perfection, 14°. - Meetings third Tuesday of each month. Geo. E. Willitts, 32°, T. P. G. M.; John Holbrook, 32°, H. T. Dept. G. M.; Owen Jones, 32°, Ven. Sen. G. W.; Oscar H. Dean, 32°, Ven. Jun. G. W.; John H. McClure, 32°, Grand Orator; John F. Crotty, 32°, Grand Treasurer; Edwin S. Butts, 32°, Grand Sec. K. of S. and A.; Edwin L. Skeen, 32°, Grand Master of Cer.; Isaac F. DuBois, 32°, Grand Hospitaller; Wm. L. Rice, 32, Grand Capt. of G.; F. M. Ackerman, 32°, Grand Organist; C. H. Dunker, 32, Grand Tiler.",,
Lansing,1894,7367236,1,Lansing Grand Council Princes of Jerusalem,Civic Organizations,,"Lansing Grand Council Princes of Jerusalem 16°- Meets on call of officers. Frank L. Gardner, 32°, M. E. S. P. G. M.; Wm. M. Clark, 33°, G. H. P. Dept. G. M.; Oscar H. Dean, 32°, M. E. Sen. G. Warden; L. E. V. Ihle, 32°, Μ. Ε. Jun. G. Warden; John F. Crotty, 32°, Val. G. Treas.; Eli Bidelman, 32°, Val. G. Sec. K. of S. and A.; John Holbrook, 32°, Val. G. Master of Cer.; Isaac F. Du Bois, 32°, Val. Grand Almoner; Eugene B. Wood, 32°, Val. Grand Master of Ent.; C. H. Dunker, 32°, Grand Tiler; J. H. McClure, 32°, Organist.",,
Lansing,1894,7367236,2,Lansing Sov. Chapter Rose Croix,Benevolent and Fraternal,,"Lansing Sov. Chapter Rose Croix, 18°. -Meets on call of officers. Henry W. Squiers, 33°, M. W. P. Master; Frank M. Ackerman, 32°, M. E. and P. K. S. W.; John Hol- brook, 32º, M. E. and P. K. J. W.; George E. Willitts, 32°, M. E. and P. K. Orator; John F. Crotty, 32°, Res. and P. K. Treas.; E. S. Butts, 32°, Res. and P. K. Sec.; Isaac F. DuBois, 32°, Res. and P. K. Hospitaller; E. L. Skeen, 32°, Res. and P. K. Mas. of C.; Geo. A. Cockburn, 32°, Res. and P. K. Capt. of G.; C. H. Dunker, 32°, Gr. Tiler; L. A. Baker, 32°, G. Organist.",,
Lansing,1894,7367236,3,Lansing Grand Council of Kadosh,Civic Organizations,,"Lansing Grand Council of Kadosh, 30° -Meets on call of the officers. Hector Urquhart, 32º, Ill. Com.; Edwin L. Skeen, 32°, Ill. 1st Lieut. Com.; Louis Beck, 32º, III. 2d Lieut. Com.; Geo. E. Willitts, 32°, Ill. M. of S. and Grand Orator; J. B. Judson, 32°, Ill. Grand Chancellor; John F. Crotty, 32°, Ill. Gr. Treas.; Eli Bidelman, 32°, Ill. G. Sec. and K. of S. and A.; O. H. Dean, 32, Ill. G. Eng. and A.; John Holbrook, 32°, Ill. Gr. Mas. of C.; Isaac F. DuBois, 32°, Ill. G. Hospitaller; J. J. Heath, 32°, Ill. G. Stand. Bearer; Eugene B. Wood, 32°, Ill. G. Capt. of the Guard; Henry W. Squiers, 33°, Ill. G. Sentinel; F. M. Ackerman, 32°, Ill. Grand Organist.",,
Lansing,1894,7367236,5,"Grand Lodge, I. O. O. F.",Benevolent and Fraternal,,"Grand Lodge, I. O. O. F.-Headquarters southwest corner Washington and Michigan avenues. E. H. Whitney, Grand Secretary.",,
Lansing,1894,7367236,6,"Grand Encampment, I. O. O. F.",Benevolent and Fraternal,,"Grand Encampment, I. O. O. F. - Headquarters southwest corner Washington and Michigan avenues. E. H. Whit- ney, Grand Scribe.",,
Lansing,1894,7367236,7,"Canton Capitol City, No. 2, I. O. O. F.",Benevolent and Fraternal,,"Canton Capitol City, No. 2, I. O. O. F.-Meets Odd Fel-",,
Lansing,1894,7367237,3,Capital Lodge No. 45,Benevolent and Fraternal,,"Capital Lodge No. 45, I. O. O. F. - Meets at Odd Fellows' Hall every Friday evening at 7:30. A. E. Leonard, N. G.; James Mevis, V. G.; Henry Boylan, Recording Secretary; A. Cook, P. S.; J. S. Bennett, Treasurer.",,
Lansing,1894,7367237,4,Friendship Encampment No. 33,Benevolent and Fraternal,,"Friendship Encampment No. 33, I. O. O. F. -Meets second and fourth Thursdays of each month at Odd Fellows' Hall. Louis Beck, C. P.; J. A. Hamilton, H. P.; E. H. Whitney, Scribe.",,
Lansing,1894,7367237,5,Protection Lodge No. 321,Benevolent and Fraternal,,"Protection Lodge No. 321, І. О. О. F.-Meets every Tuesday evening at Odd Fellows' Hall, Franklin east. George Leatherman, N. G.; Ed. Rowley, V. G,; T. B. Blosser, Secretary; H. C. McKeen, Treasurer; Jay M. Smith, Representative to the Grand Lodge.",,
Lansing,1894,7367237,6,"Daughters of Rebecca, Gleaners' Lodge No. 74",Benevolent and Fraternal,,"Daughters of Rebecca, Gleaners' Lodge No. 74, I. O. O. F. -Meets second and fourth Wednesdays of each month, Odd Fellows' Hall. Mrs. Sarah Bennett, N. G.; Mrs. Frankie Moses, V. G.; Clara Butler, Secretary; Ada J. Whitman, Financial Secretary; Mrs W. H. Horton, Treasurer.",,
Lansing,1894,7367237,7,"Division No. 1, А. О. Н.",Benevolent and Fraternal,,"Division No. 1, А. О. Н.- Meets second and fourth Thursday of each month, at Markey's Hall. T. K. Jefferys, C. D.; Daniel O'Reilly, President; Robt. Craig, Vice President; M. F. Hughes, Financial Secretary; James Markey, Treasurer; R McQuillan, Recording Secretary; Thomas Magner, Sergeant-at-arms; Thomas Harvey, Doorkeeper.",,
Lansing,1894,7367237,8,Lansing Lodge No 54,Benevolent and Fraternal,,"Lansing Lodge No 54.-Meets every Thursday evening at A. O. U. W. Hall, 303 Washington avenue south. J. Lamoreaux, M. W.; H. R. Davis, F.; P. S. Phillips, O.; J. C. Everett, Recorder; J. W. Carey, Financier; J. Bruno, Receiver.",,
Lansing,1894,7367237,9,Lansing Lodge No. 196,Benevolent and Fraternal,,Lansing Lodge No. 196. - Meets every Tuesday evening at,,
Lansing,1894,7367238,1,Elks' Hall,Benevolent and Fraternal,,"Elks' Hall, 107-11 Allegan east. Alex. Blair, E. R.; W. N. Cutler, E. L. K.; Joseph W. Selden, E. L. K.; C. P. Downey, Treasurer.",,
Lansing,1894,7367238,2,"Charles T. Foster Post, No. 42",Benevolent and Fraternal,,"Charles T. Foster Post, No. 42-Meets every Tuesday even- ing at G. A. R. Hall. Sydney Edson, C.; Theo. Bortle, S. V. C.; G. J. Foster, J. V. C.; J. W. Garlick, Q. M.; Wm. Putnam, Chaplain; A. S. Boyce, O. of D.; I. N. Ashley, O. of G.; H. D. Warner, Adj.; F. M. Pierce, S. M.; J. A. Bowen, Q. M. S.",,
