city,year,page,line_no,organization_name,category,sub_category,line,address,description
Stockton,1897,32701,18,SUNSET TELEPHONE AND TELEGRAPH CO,Uncategorized,,"SUNSET TELEPHONE AND TELEGRAPH CO-John Kearns, supt; s e cor Channel and San Joaquin.",,
Stockton,1897,32701,19,WESTERN UNION TELEGRAPH CO,Uncategorized,,"WESTERN UNION TELEGRAPH CO-J H Sharon, mgr; 130 E Main.",,
Stockton,1897,32701,20,US LAND OFFICE,Uncategorized,,US LAND OFFICE,,
Stockton,1899,32701,1,YOUNG MEN'S CHRISTIAN ASSOCIATION FREE PUBLIC LIBRARY,Libraries,,"EDULCA B PRANTO LA BOGU STAL Jasti Schools alles in Grounde -C.J. Jones, 14 F. Buck STOCKTON CITY DIRECTORY. PUBLIC LIBRARIES. HAZELTON FREE PUBLIC LIBRARY. Northeast corner Hunter and Market Trustees-F. D. Nicol, Fred M. West, J. A. Sanford, S. N. Cross and George LIBRARIAN W. F. CLOWDSLEY Assistants-Hattimaie Mann, Ida C. Grunsky and Phoebe J. Brown YOUNG MEN'S CHRISTIAN ASSOCIATION FREE PUBLIC LIBRARY. 327 East Weber avenue L. C. Dale general secretary. Free reading room, open from 9 a. m. to 10 p. m.; Sundays 10 a. m. to 6 p. m. PRESIDENT. BOARD OF HEALTH. SECRETARY AND HEALTH OFFICER DR. W. W. FITZGERALD ..DR. W. E. GIBBONS .... DR. C. A. RUGGLES DR. S. B. DAVIS DR. S. N. CROSS CHIEF OF POLICE. POLICE DEPARTMENT. JOHN D. GALL SPERINTENDEN ..M. H. KINGSBURY CAPTAIN OF POLICE.. Detectives-Michael Carroll and D. L. Klench Patrolmen-John H. Craig, M. M. Diarmid, W. H. Dutschke, N. B. Edwards, M. Finnell, J. W. Gill, B. Kenyon, O. Marshall, W. M. Simpson, W. L. Walker and M. Welsh JUSTICE COURTS. JUSTICE OF THE PEACE.. .ALBERT C. PARKER O'Brien building, opposite Courthouse JUSTICE OF THE PEACE O'NEAL TOWNSHIP.......OTTO VON DETTEN Corner East and Main WARD BOUNDARIES. First Ward includes all that portion of the city south of Main and west of Sutter Second Ward includes all that portion of the city north of Main and west of Sutter Third Ward includes all that portion of the city south of Main and east of Sutter Fourth Ward includes all that portion of the city north of Main and east of Sutter 00 A WIBLEY.. Re Lindsay VE WURINGON.....",,
Stockton,1899,32701,19,GAS CITY BUSINESS COLLEGE,Uncategorized,,"GAS CITY BUSINESS COLLEGE-Salz building, Hunter-street square, opposite Courthouse, C. E. Doan proprietor",,
Stockton,1899,32701,20,KINDERGARTEN,Uncategorized,,"KINDERGARTEN-415 N. El Dorado, Mrs. E. M. Tureman",,
Stockton,1899,32701,21,PARKER INSTITUTE OF SHORTHAND AND TYPEWRITING,Uncategorized,,"PARKER INSTITUTE OF SHORTHAND AND TYPEWRITING-Rooms 6 and 7 Masonic temple, E. S. Parker proprietor",,
Stockton,1899,32701,22,PREPARATORY SCHOOLS,Uncategorized,,"PREPARATORY SCHOOLS-Mrs. Sarah M. Beebe, 304 N. Hunter; Mrs. Kate Dodge, 734 N. California; Mrs. M. S. Klein, 616 E. Channel",,
Stockton,1899,32701,23,ST. AGNES' ACADEMY,Uncategorized,,ST. AGNES' ACADEMY-Corner San Joaquin and Taylor,,
Stockton,1899,32701,24,ST. MARY'S COLLEGE,Uncategorized,,ST. MARY'S COLLEGE-Corner San Joaquin and Washington,,
Stockton,1899,32701,25,ST. JOSEPH'S SCHOOL,Uncategorized,,ST. JOSEPH'S SCHOOL-Grant between Fremont and Aurora,,
Stockton,1899,32701,26,STOCKTON BUSINESS COLLEGE AND NORMAL INSTITUTE,Uncategorized,,"STOCKTON BUSINESS COLLEGE AND NORMAL INSTITUTE-South-east corner California and Channel, William C. Ramsey proprietor",,
Stockton,1899,32701,27,"YORK'S PRACTICAL SCHOOL, NORMAL ACADEMY AND BUSINESS INSTITUTE",Uncategorized,,"YORK'S PRACTICAL SCHOOL, NORMAL ACADEMY AND BUSINESS INSTITUTE-Third floor Clark & Henery building",,
Stockton,1899,32701,1,JEWISH. Jewish Synagogue-Hunter,Churches,,"JEWISH. Jewish Synagogue-Hunter between Fremont and Lindsay, Rev. R. Farber rabbi",,
Stockton,1899,32701,2,METHODIST EPISCOPAL Central,Churches,,"METHODIST EPISCOPAL Central-Corner Miner avenue and San Joaquin, Rev. W. C. Evans pastor",,
Stockton,1899,32701,3,Chinese Mission,Churches,,Chinese Mission-30412 E. Market,,
Stockton,1899,32701,4,Clay-street-Corner San Joaquin and Clay,Churches,,"Clay-street-Corner San Joaquin and Clay, Rev. John W. Ross pastor",,
Stockton,1899,32701,5,Ebenezer (colored),Churches,,"Ebenezer (colored)-225 S. Commerce, Rev. W. W. Grimes pastor",,
Stockton,1899,32701,6,Epworth Chapel of the Central M. E. Church,Churches,,"Epworth Chapel of the Central M. E. Church-Fair Oaks, Rev. W. C. Evans pastor",,
Stockton,1899,32701,7,German-Corner American and Lindsay,Churches,,"German-Corner American and Lindsay, Rev. George W. Schroeder pastor",,
Stockton,1899,32701,8,Grace (South),Churches,,"Grace (South)-Weber avenue between California and Sutter, Rev. H. С. Meredith pastor",,
Stockton,1899,32701,9,The Reorganized Church of Jesus Christ of Latter-Day Saints,Churches,,The Reorganized Church of Jesus Christ of Latter-Day Saints-Sutter between Clay and Jackson,,
Stockton,1899,32701,10,First Presbyterian,Churches,,"First Presbyterian-San Joaquin between Main and Market, Rev. J. Wilson Lundy pastor",,
Stockton,1899,32701,11,First Cumberland,Churches,,"First Cumberland-San Joaquin between Miner avenue and Lindsay, Rev. E. L. B. McClellan pastor",,
Stockton,1899,32701,12,First Presbyterian Chinese Mission,Churches,,First Presbyterian Chinese Mission-386 S. Hunter,,
Stockton,1899,32701,13,Independent,Churches,,Independent-1344 E. Channel,,
Stockton,1899,32701,14,Stockton Peniel Mission,Churches,,Stockton Peniel Mission-19 E. Main,,
Stockton,1899,32701,15,Salvation Army Barracks,Welfare Organizations,,Salvation Army Barracks-Sutter between Main and Market,,
Stockton,1899,32701,16,Volunteers of America,Welfare Organizations,,Volunteers of America-Market between Hunter and Sutter,,
Stockton,1899,32701,17,Church of Christ,Churches,,"Church of Christ-Jory's hall, Weber avenue between California and Sutter",,
Stockton,1899,32701,18,Theosophical Society of Universal Brotherhood,Benevolent and Fraternal,,"Theosophical Society of Universal Brotherhood-Masonic temple, room 12 hall",,
Stockton,1899,32701,2,FATHER MATTHEW TOTAL ABSTINENCE AND BENEVOLENT SOCIETY,Benevolent and Fraternal,,FATHER MATTHEW TOTAL ABSTINENCE AND BENEVOLENT SOCIETY Meets second and fourth Fridays of each month in Y. M. I. hall,,
Stockton,1899,32701,3,GRAND ARMY OF THE REPUBLIC,Patriotic Organizations,,"GRAND ARMY OF THE REPUBLIC. Rawlins Post, No. 23-Meets first and third Wednesdays at Native Sons' hall Woman's Relief Corps-Meets first and third Fridays at Native Sons' hall",,
Stockton,1899,32701,4,INDEPENDENT ORDER B'NAI BRITH,Benevolent and Fraternal,,"INDEPENDENT ORDER B'NAI BRITH. Hope Lodge, No. 126-Meets first and third Sundays at 2:30 p. m. at Union hall",,
Stockton,1899,32701,5,INDEPENDENT ORDER GOOD TEMPLARS,Benevolent and Fraternal,,"INDEPENDENT ORDER GOOD TEMPLARS. Stockton Lodge, No. 182-Meets every Monday evening at Druids' hall",,
Stockton,1899,32701,6,Kaw-Wau-Nita Council No. 12,Patriotic Organizations,,"IMPROVED ORDER OF RED MEN. Iroquois Tribe, No. 35-Meets Thursdays at Fraternal hall Kaw-Wau-Nita Council No. 12, Degree of Pocahontas-Meets Wednesdays at Fraternal hall Pohono Tribe, No. 93-Meets Thursdays at Fraternal hall Hiawatha Council, No. 21-Meets Mondays at Fraternal hall",,
Stockton,1899,32701,7,INDEPENDENT ORDER OF FORESTERS,Benevolent and Fraternal,,"INDEPENDENT ORDER OF FORESTERS. Court Yo Semite, No. 1275-Meets second and third Thursdays at Union hall Court Confidence, No. 3776-Meets first and third Tuesdays at Union hall",,
Stockton,1899,32701,8,INDEPENDENT ORDER OF ODD FELLOWS,Benevolent and Fraternal,,"INDEPENDENT ORDER OF ODD FELLOWS. Charity Lodge, No. 6-Meets Wednesdays at Odd Fellows' hall Stockton Lodge, No. 11-Meets Fridays at Odd Fellows' hall Truth Lodge, No. 55-Meets Saturdays at Odd Fellows' hall Parker Encampment, No. 3-Meets first and third Mondays at Odd Fellows' hall Canton Ridgley, No. 15-Meets second and fourth Tuesdays at Odd Fellows' hall Lebanon Rebekah Lodge, No. 41-Meets second and fourth Mondays at Odd Fellows' hall Rainbow Rebekah Lodge, No. 97-Meets first and third Thursdays at Odd Fellows' hall Relief Committee-Eugene Bartholomew president; M. H. Kingsbury secretary",,
Stockton,1899,32701,9,ITALIAN BERSAGLIERI SOCIETY,Benevolent and Fraternal,,ITALIAN BERSAGLIERI SOCIETY. Meets first Sunday in each month at Bersaglieri hall,,
Stockton,1899,32701,10,Le Jana Temple,Secret Societies,,MALE Le Jana Temple Ni Baliroent Park Section,,
Stockton,1899,32701,1,Y. ENEVOLENTSOO,Uncategorized,,Y. ENEVOLENTSOO,,
Stockton,1899,32701,2,Y. M. I. hall,Uncategorized,,Y. M. I. hall,,
Stockton,1899,32701,3,BLIC.,Uncategorized,,BLIC.,,
Stockton,1899,32701,4,Native S,Uncategorized,,sdays at Native S,,
Stockton,1899,32701,5,Native So,Uncategorized,,ays at Native So,,
Stockton,1899,32701,7,EMPLARS.,Uncategorized,,ays at 2:30 p. m. at EMPLARS.,,
Stockton,1899,32701,8,Druids hal,Uncategorized,,evening at Druids hal,,
Stockton,1899,32701,10,aternal hall,Benevolent and Fraternal,,aternal hall,,
Stockton,1899,32701,11,ahontas-Meets Wed,Uncategorized,,ahontas-Meets Wed,,
Stockton,1899,32701,12,ternal hall,Benevolent and Fraternal,,ternal hall,,
Stockton,1899,32701,13,Fraternal hall,Benevolent and Fraternal,,Fraternal hall,,
Stockton,1899,32701,14,ORESTERS.,Benevolent and Fraternal,,ORESTERS.,,
Stockton,1899,32701,15,Un,Uncategorized,,hird Thursdays at Un,,
Stockton,1899,32701,16,Un,Uncategorized,,rd Tuesdays at Unin,,
Stockton,1899,32701,17,FELLOWS.,Benevolent and Fraternal,,D FELLOWS.,,
Stockton,1899,32701,18,Odd Fellows' hall,Benevolent and Fraternal,,Odd Fellows' hall,,
Stockton,1899,32701,19,d Fellows' hall,Benevolent and Fraternal,,d Fellows' hall,,
Stockton,1899,32701,20,d Fellows' hall,Benevolent and Fraternal,,d Fellows' hall,,
Stockton,1899,32701,21,Oil,Uncategorized,,Third Mondays at Oil,,
Stockton,1899,32701,22,Od,Uncategorized,,urth Tuesdays at Od,,
Stockton,1899,32701,23,nd and fourth Monda,Uncategorized,,nd and fourth Monda,,
Stockton,1899,32701,24,st and third Thursda,Uncategorized,,st and third Thursda,,
Stockton,1899,32701,25,M. H. Kings,Uncategorized,,sident: M. H. Kings,,
Stockton,1899,32701,30,KNIGHTS OF HONOR,Benevolent and Fraternal,,KNIGHTS OF HONOR.,,
Stockton,1899,32701,31,"Stockton Lodge, No. 1596",Benevolent and Fraternal,,"Stockton Lodge, No. 1596-Meets second and fourth Wednesdays at Elliott's law office, Eldridge building",,
Stockton,1899,32701,32,KNIGHTS OF THE GOLDEN EAGLE,Benevolent and Fraternal,,KNIGHTS OF THE GOLDEN EAGLE.,,
Stockton,1899,32701,33,"Stockton Castle, No. 8",Benevolent and Fraternal,,"Stockton Castle, No. 8-Meets every Saturday evening at Druids' hall",,
Stockton,1899,32701,34,KNIGHTS OF PYTHIAS,Benevolent and Fraternal,,KNIGHTS OF PYTHIAS.,,
Stockton,1899,32701,35,"Charter Oak Lodge, No. 20",Benevolent and Fraternal,,"Charter Oak Lodge, No. 20-Meets Wednesdays at Pythian hall",,
Stockton,1899,32701,36,"Centennial Lodge, No. 38",Benevolent and Fraternal,,"Centennial Lodge, No. 38-Meets Tuesdays at Pythian hall",,
Stockton,1899,32701,37,"Willow Lodge, No. 55",Benevolent and Fraternal,,"Willow Lodge, No. 55-Meets Mondays at Pythian hall",,
Stockton,1899,32701,38,"Nemo Lodge, No. 161",Benevolent and Fraternal,,"Nemo Lodge, No. 161-Meets Thursdays at Pythian hall",,
Stockton,1899,32701,39,"Damon Temple, No. 23, Rathbone Sisters",Benevolent and Fraternal,,"Damon Temple, No. 23, Rathbone Sisters-Meets first and third Fridays at Pythian hall",,
Stockton,1899,32701,40,"Endowment Rank, Section No. 175",Benevolent and Fraternal,,"Endowment Rank, Section No. 175-J. R. Clayes president; H. R. Campbell secretary",,
Stockton,1899,32701,42,"Yo Semite Tent, No. 35",Benevolent and Fraternal,,"Yo Semite Tent, No. 35-Meets every Saturday at Union hall",,
Stockton,1899,32701,43,LADIES OF THE MACCABEES,Benevolent and Fraternal,,LADIES OF THE MACCABEES.,,
Stockton,1899,32701,44,Stockton Hive,Benevolent and Fraternal,,Stockton Hive-Meets every Friday at Union hall,,
Stockton,1899,32701,45,LADIES' BENEFICIAL ENTERPRISE ASSOCIATION,Benevolent and Fraternal,,LADIES' BENEFICIAL ENTERPRISE ASSOCIATION.,,
Stockton,1899,32701,46,Mrs. J. A. Hut- ton,Benevolent and Fraternal,,Meets first Friday in each month. Mrs. L. Epps president Mrs. J. A. Hut- ton secretary,,
Stockton,1899,32701,47,MASONIC BODIES,Benevolent and Fraternal,,MASONIC BODIES.,,
Stockton,1899,32701,48,"San Joaquin Lodge, No. 19",Benevolent and Fraternal,,"San Joaquin Lodge, No. 19-Meets Monday on or before full moon at Ma- sonic temple",,
Stockton,1899,32701,49,"Morning Star Lodge, No. 68",Benevolent and Fraternal,,"Morning Star Lodge, No. 68-Meets second Thursday in each month at Ma- sonic temple",,
Stockton,1899,32701,51,"Stockton Chapter, No. 28",Benevolent and Fraternal,,"Stockton Chapter, No. 28-Meets second Tuesday in each month at Masonic temple",,
Stockton,1899,32701,52,ROYAL AND SELECT MASONS,Benevolent and Fraternal,,ROYAL AND SELECT MASONS.,,
Stockton,1899,32701,53,"Stockton Council, No. 10",Benevolent and Fraternal,,"Stockton Council, No. 10-Meets fourth Friday in each month at Masonic temple",,
Stockton,1899,32701,1,STOCKTON CITY DIRECTORY,Uncategorized,,STOCKTON CITY DIRECTORY.,,
Stockton,1899,32701,2,KNIGHTS TEMPLAR,Secret Societies,,KNIGHTS TEMPLAR.,,
Stockton,1899,32701,3,Stockton Commandery,Secret Societies,,"Stockton Commandery, No. 8-Meets first Friday in each month at Masonic temple",,
Stockton,1899,32701,4,ORDER OF EASTERN STAR,Secret Societies,,ORDER OF EASTERN STAR.,,
Stockton,1899,32701,5,Homo Chapter,Secret Societies,,"Homo Chapter, No. 50-Meets second and fourth Wednesdays of each month at Masonic temple",,
Stockton,1899,32701,6,NATIVE SONS OF THE GOLDEN WEST,Benevolent and Fraternal,,NATIVE SONS OF THE GOLDEN WEST.,,
Stockton,1899,32701,7,Stockton Parlor,Secret Societies,,"Stockton Parlor, No. 7-Meets every Monday at Native Sons' hall",,
Stockton,1899,32701,8,Stockton Cave,Secret Societies,,"Stockton Cave, No. 9, Curly Bears-Meets at call of chairman at Native Sons' hall",,
Stockton,1899,32701,9,NATIVE DAUGHTERS OF THE GOLDEN WEST,Benevolent and Fraternal,,NATIVE DAUGHTERS OF THE GOLDEN WEST.,,
Stockton,1899,32701,10,San Joaquin Parlor,Secret Societies,,"San Joaquin Parlor, No. 5-Meets second and fourth Fridays at Native Sons' hall",,
Stockton,1899,32701,11,NATIONAL UNION,Uncategorized,,NATIONAL UNION.,,
Stockton,1899,32701,12,San Joaquin Council,Benevolent and Fraternal,,"San Joaquin Council, No. 756-Meets first Monday after 10th of each month at Arcade building",,
Stockton,1899,32701,13,PORTUGUESE SOCIETY,Civic Organizations,,PORTUGUESE SOCIETY.,,
Stockton,1899,32701,14,Concilho Fernando Magalhaez,Secret Societies,,"Concilho Fernando Magalhaez, No. 24-Meets first and third Sundays at Y. M. I. hall",,
Stockton,1899,32701,15,PASTORS' UNION,Uncategorized,,PASTORS' UNION.,,
Stockton,1899,32701,18,Stockton Grange,Benevolent and Fraternal,,"Stockton Grange, No. 70-Meets Saturdays at 1:30 p. m. at Fraternal hall",,
Stockton,1899,32701,19,SAN JOAQUIN SOCIETY OF CALIFORNIA PIONEERS,Benevolent and Fraternal,,SAN JOAQUIN SOCIETY OF CALIFORNIA PIONEERS.,,
Stockton,1899,32701,21,ST. MARY'S TOTAL ABSTINENCE SOCIETY,Uncategorized,,ST. MARY'S TOTAL ABSTINENCE SOCIETY.,,
Stockton,1899,32701,23,STOCKTON EXEMPT FIRE COMPANY,Uncategorized,,STOCKTON EXEMPT FIRE COMPANY.,,
Stockton,1899,32701,27,"STOCKTON TYPOGRAPHICAL UNION, NO. 56",Uncategorized,,"STOCKTON TYPOGRAPHICAL UNION, NO. 56.",,
Stockton,1899,32701,1,UNITED ANCIENT ORDER DRUIDS,Secret Societies,,"UNITED ANCIENT ORDER DRUIDS. Concordia Grove, No. 98-Meets Wednesdays at Druids' hall San Joaquin Grove, No. 9-Meets Thursdays at Druids' hall",,
Stockton,1899,32701,2,UNION FRATERNAL LEAGUE,Secret Societies,,"UNION FRATERNAL LEAGUE. Stockton Assembly, No. 50-Meets Fridays at Fraternal hall",,
Stockton,1899,32701,3,VEREIN EINTRACHT,Secret Societies,,VEREIN EINTRACHT. Meets first and third Mondays at Bersaglieri hall,,
Stockton,1899,32701,4,WOMAN'S CHRISTIAN TEMPERANCE UNION,Welfare Organizations,,WOMAN'S CHRISTIAN TEMPERANCE UNION. Meets every Tuesday at 2:30 p. m. at Fraternal hall,,
Stockton,1899,32701,5,WOODMEN OF THE WORLD,Secret Societies,,"WOODMEN OF THE WORLD. Commercial Camp, No. 106-Meets Fridays at Fraternal hall Camp Stockton, No. 348-Meets Wednesdays at Fraternal hall",,
Stockton,1899,32701,6,YOUNG MEN'S CHRISTIAN ASSOCIATION,Youth Organizations,,"YOUNG MEN'S CHRISTIAN ASSOCIATION. Hodgkins building 327 Weber avenue. L. C. Dale general secretary. Members meet January, April, July and October; directors meet first Monday of each month",,
Stockton,1899,32701,7,YOUNG MEN'S INSTITUTE,Youth Organizations,,"YOUNG MEN'S INSTITUTE. Young Men's Institute, No. 5-Meets first and third Wednesdays at Y. M. I. hall",,
Stockton,1899,32701,8,STOCKTON AND SAN FRANCISCO EXPRESS CO.,Uncategorized,,"EXPRESS COMPANIES. RIVER EXPRESS CO.-Northwest corner Sutter and Market STOCKTON AND SAN FRANCISCO EXPRESS CO.-With Union Transportation Co. corner Channel and El Dorado WELLS, FARGO & CO.-Northeast corner Sutter and Market",,
Stockton,1899,32701,9,"COMPANY A, SIXTH REGIMENT, N. G. C.",Uncategorized,,"MILITIA COMPANIES. CALIFORNIA RANGERS--San Joaquin Troop, No. 7-Meet at call of Sheriff Thomas Cunningham, commander COMPANY A, SIXTH REGIMENT, N. G. C.-Meets every Monday evening at Armory south side Weber avenue between Sutter and San Joaquin COMPANY B, SIXTH REGIMENT, N. G. C.-Meets every Monday evening at Armory south side Weber avenue between Sutter and San Joaquin VETERAN GUARDS-Meet every Monday evening in Grangers' Union building southeast corner California and Weber avenue each month at M",,
Stockton,1899,32701,1,ASSOCIATED CHARITIES,Benevolent and Fraternal,,"ASSOCIATED CHARITIES-Room 7, Courthouse. Orrin S. Henderson president; J. W. Kerrick treasurer; Lizzie H. Condy secretary; A. Eckstrom registrar",,
Stockton,1899,32701,2,CATHOLIC LADIES' AID SOCIETY,Benevolent and Fraternal,,"CATHOLIC LADIES' AID SOCIETY, No. 7-Y. M. I. hall corner San Joaquin and Washington. Mrs. M. Morrissey matron",,
Stockton,1899,32701,3,CHILDREN'S AND OLD PEOPLE'S HOME,Welfare Organizations,,CHILDREN'S AND OLD PEOPLE'S HOME-1308 E. Lafayette. Mrs. E. C. Weber matron,,
Stockton,1899,32701,4,GUN CLUB ANNEX,Clubs,,GUN CLUB ANNEX-Stockton Athletic Association. Arthur Wright secretary; clubhouse Goodwater Grove,,
Stockton,1899,32701,5,JOURNEYMEN TAILORS' UNION,Labor Organizations,,JOURNEYMEN TAILORS' UNION No. 84-Meets second and fourth Mondays at Native Sons' hall. Thomas Reid president; Max Goldmann secretary,,
Stockton,1899,32701,6,LADIES' AID SOCIETY,Benevolent and Fraternal,,LADIES' AID SOCIETY-1308 E. Lafayette. Mrs. J. H. Hough president,,
Stockton,1899,32701,7,MASONIC HALL ASSOCIATION,Secret Societies,,MASONIC HALL ASSOCIATION-J. D. Peters president; Arthur M. Noble secretary,,
Stockton,1899,32701,8,NAOMI CLUB,Clubs,,NAOMI CLUB-720 N. Hunter. A. H. Harlin president; Horace Vincent secretary and treasurer,,
Stockton,1899,32701,9,OLD FRIENDS' SOCIAL CLUB,Youth Organizations,,OLD FRIENDS' SOCIAL CLUB-Rooms 419 and 420 Yo Semite theater building. Meets first Wednesday of each month. Dr. C. A. Ruggles president; B. S. Curry secretary,,
Stockton,1899,32701,10,PIONEER HALL ASSOCIATION,Civic Organizations,,PIONEER HALL ASSOCIATION-John H. Field president; William Robinson secretary,,
Stockton,1899,32701,11,"ROAD CLUB ANNEX, STOCKTON ATHLETIC ASSOCIATION",Clubs,,"ROAD CLUB ANNEX, STOCKTON ATHLETIC ASSOCIATION-William E. O'Connor president; A. Frank Harrison secretary and treasurer; John Seybold captain",,
Stockton,1899,32701,12,SAN JOAQUIN VALLEY AGRICULTURAL ASSOCIATION,Civic Organizations,,SAN JOAQUIN VALLEY AGRICULTURAL ASSOCIATION-Pavilion San Joaquin between Washington and Lafayette; race track corner South and Sharp's lane. F. D. Cobb president; C. E. Doan secretary and treasurer; R. W. Russell track superintendent,,
Stockton,1899,32701,13,STOCKTON ATHLETIC ASSOCIATION,Clubs,,STOCKTON ATHLETIC ASSOCIATION-Clubhouse Weber Peninsula. Dr. J. James Tully president; Fred M. Price secretary,,
Stockton,1899,32701,14,STOCKTON BASEBALL CLUB,Clubs,,STOCKTON BASEBALL CLUB-Grounds Goodwater Grove. George H. Campbell secretary and manager,,
Stockton,1899,32701,15,STOCKTON CALEDONIAN CLUB,Clubs,,STOCKTON CALEDONIAN CLUB-Meets Tuesdays at Union hall. W. B. Fyfe chief; J. T. Haddow third chief,,
Stockton,1899,32701,1,STOCKTON CITY DIRECTORY,Uncategorized,,STOCKTON CITY DIRECTORY.,,
Stockton,1899,32701,6,STOCKTON COMMERCIAL ASSOCIATION,Civic Organizations,,STOCKTON COMMERCIAL ASSOCIATION-Rooms 427 and 428 Yo Semite theater building. P. A. Buell president; Orrin S. Henderson secretary,,
Stockton,1899,32701,7,STOCKTON GUN CLUB,Civic Organizations,,STOCKTON GUN CLUB-Clubhouse Jackson Baths. William Keyes presi- dent; William Ditz secretary,,
Stockton,1899,32701,8,STOCKTON HIGH SCHOOL ALUMNI ASSOCIATION,Youth Organizations,,STOCKTON HIGH SCHOOL ALUMNI ASSOCIATION-John W. Kerrick president; Orrin S. Henderson secretary,,
Stockton,1899,32701,9,STOCKTON JOURNEYMEN BUTCHERS' PROTECTIVE AND BENEVO-LENT ASSOCIATION,Benevolent and Fraternal,,"STOCKTON JOURNEYMEN BUTCHERS' PROTECTIVE AND BENEVO-LENT ASSOCIATION, NO. 6-Meets second and fourth Thursdays at Y. M. I. hall. Gus Alden president; John B. Northgrave secretary",,
Stockton,1899,32701,10,STOCKTON RIFLE AND PISTOL CLUB,Civic Organizations,,STOCKTON RIFLE AND PISTOL CLUB-Butts Jackson Baths. Leo F. Salbach president; Henry Kroeckel secretary,,
Stockton,1899,32701,11,STOCKTON TENNIS CLUB,Civic Organizations,,STOCKTON TENNIS CLUB-Courts corner Hunter and Flora. Otto Grun-sky president; Charles M. Littlehale secretary,,
Stockton,1899,32701,12,STOCKTON TURN VEREIN,Civic Organizations,,STOCKTON TURN VEREIN-Turn Verein hall 110 N. Hunter. H. J. Kuechler president; J. Wirth secretary,,
Stockton,1899,32701,13,TERMINAL CITY WHEELMEN,Youth Organizations,,TERMINAL CITY WHEELMEN-Odd Fellows' building. Leo F. Salbach president George Brown secretary,,
Stockton,1899,32701,14,YO SEMITE CLUB,Youth Organizations,,YO SEMITE CLUB-Yo Semite theater building. H. R. McNoble presi- dent; R. W. Williamson secretary,,
Stockton,1899,32701,15,SSOCIATION,Uncategorized,,d president; William TIC ASSOCIATION secretary and trek SSOCIATION-Pari ce track corner Sou retary and treasurer ubhouse Weber Pe tary Dodwater Grove. Ge esdays at Union,,
Stockton,1899,32701,17,AVON THEATER,Uncategorized,,AVON THEATER-Southeast corner Main and California,,
Stockton,1899,32701,18,EINTRACHT PARK,Uncategorized,,"EINTRACHT PARK-Eastern terminus Stockton electric railway, dancing pavilion and picnic grove",,
Stockton,1899,32701,19,GOODWATER GROVE,Uncategorized,,"GOODWATER GROVE-Northern terminus Stockton electric railroad, athletic track, baseball grounds, picnic grove and dancing pavilion",,
Stockton,1899,32701,20,JACKSON BATHS,Uncategorized,,"JACKSON BATHS-Southern terminus Stockton electric railroad, mineral baths, swimming tank and dancing pavilion",,
Stockton,1899,32701,21,TIVOLI THEATER,Uncategorized,,"TIVOLI THEATER-East side El Dorado between Main and Market, vaudeville performance every evening excepting Sundays",,
Stockton,1899,32701,22,YO SEMITE THEATER,Uncategorized,,YO SEMITE THEATER-San Joaquin opposite Courthouse between Main and Weber avenue,,
Stockton,1901,1,1,Farmers and Merchants' Bank,Uncategorized,,"Farmers and Merchants' Bank-Philip B. Fraser, president; David S. Rosenbaum, vice-president; Charles H. Keagle, cashier.",,
Stockton,1901,1,2,First National Bank of Stockton,Uncategorized,,"First National Bank of Stockton-H. H. Hewlett, president; Jas H. Hough, cashier.",,
Stockton,1901,1,3,San Joaquin Valley,Uncategorized,,"San Joaquin Valley-J. M. Welsh, president; R. B. Teefy, cashier.",,
Stockton,1901,1,4,Stockton Savings Bank,Uncategorized,,"Stockton Savings Bank-J. D. Peters, president; Sidney Newell, cashier.",,
Stockton,1901,1,5,Stockton Savings and Loan Society,Uncategorized,,"Stockton Savings and Loan Society-Fred M. West, president; W. W. Westbay, cashier.",,
Stockton,1901,10,1,Native Sons' Hall,Benevolent and Fraternal,,"N. D. G. W., Joaquin Parlor, No. 5-Meets 2d and 4th Fridays, Native Sons' Hall",,
Stockton,1901,10,2,Associated Charities,Welfare Organizations,,"Associated Charities-Court House. D. C. Shepherd, president. A. Eckstrom, registrar; Mrs. L. H. Condy, secretary.",,
Stockton,1901,10,3,Fraternal Hall,Secret Societies,,"B'nai B'rith, Hope Lodge, No. 126-Meets every Sunday, Fraternal Hall.",,
Stockton,1901,10,4,Stockton Lodge,Secret Societies,,"B. P. O. E., Stockton Lodge, No. 218-Meets every Tuesday evening, Elks Hall, Mail Building.",,
Stockton,1901,10,5,Catholic Ladies' Aid Society,Benevolent and Fraternal,,"Catholic Ladies' Aid Society, No. 7-Meets every Tuesday evening, Y. M. I. Hall.",,
Stockton,1901,10,6,Father York's Literary Society,Youth Organizations,,"Father York's Literary Society-Meets every Tuesday evening, Y. M. I. Hall.",,
Stockton,1901,10,7,Red Men's Hall,Secret Societies,,"Fraternal Brotherhood, No. 108-Meets every Tuesday evening, Red Men's Hall.",,
Stockton,1901,10,8,Horseshoers' National Protective Association,Labor Organizations,,"Horseshoers' National Protective Association, No. 119-Meets 2d and 4th Tuesdays each month, Native Sons' Hall.",,
Stockton,1901,10,9,"Journeymen Butchers, P. and B. Association",Labor Organizations,,"Journeymen Butchers, P. and B. Association, Branch No. 6-Meets 2d and 4th Tuesday evenings each month, Y. M. I. Hall.",,
Stockton,1901,10,10,Knights of the Maccabees,Secret Societies,,"Knights of the Maccabees Meets every Monday evening, 321 N. California.",,
Stockton,1901,10,11,Red Men's Hall,Secret Societies,,"Modern Woodmen-Meets every Friday evening, Red Men's Hall.",,
Stockton,1901,10,12,Red Men's Hall,Secret Societies,,"O. C. F.-Meets every 3d Tuesday evening each month, Red Men's Hall.",,
Stockton,1901,10,13,Native Sons' Hall,Secret Societies,,"Order of Pendo, No. 146-Meets every Wednesday evening, Native Sons' Hall.",,
Stockton,1901,10,14,Stockton Grange,Civic Organizations,,"P. of H., Stockton Grange, No. 70-Meets Saturday 2:30 p. m., Fraternal Hall.",,
