city,year,page,line_no,organization_name,category,sub_category,line,address,description
Worcester,1929,10188759,12,BRANCH CHARLES STEWART PARNELL,Benevolent and Fraternal,,"BRANCH CHARLES STEWART PARNELL-Chief Ranger, Dennis J. Kelliher; Sub Chief Ranger, Jeremiah J. Hart; Treas., John F. Hanley; Rec. Sec., Daniel Leary; Fin. Sec., Daniel J. Clifford. Meets third Monday night of each month at 26 Trumbull street.",,
Worcester,1929,10188759,13,BRANCH COMMODORE JACK BARRY,Benevolent and Fraternal,,"BRANCH COMMODORE JACK BARRY-Chief Ranger, Edward A. O'Toole; Fin. Sec., John F. Farley; Rec. Sec., Richard T. Whalen; Treas., Joseph F. Leahy. Meets first Thursday of each month at 26 Trumbull street.",,
Worcester,1929,10188759,14,BRANCH AVOCA,Benevolent and Fraternal,,"BRANCH AVOCA-Chief Ranger, Mrs. Mary Dunkerton; Sub Chief Ranger, Mrs. Catherine Carney; Fin. Sec., Mary Rooney; Rec. Sec., Mrs. Nellie B. Reidy; Treas., Mary T. Kelly. Meets second Wednesday of each month at 26 Trumbull street.",,
Worcester,1929,10188759,15,Italian-American War Veterans Inc.,Patriotic Organizations,,"Italian-American War Veterans Inc. -Commander, Frank Bellizzi; Vice-Com., Clio D'Argenio; Quartermaster, Gabriele DiCosmo; Relief Officer, Joseph de Marco; Financial Officer, Gabriele DiCosmo. Meets first and third Sunday at 156 Shrewsbury street",,
Worcester,1929,10188759,16,Jewish Home for Aged and Orphans,Welfare Organizations,,"Jewish Home for Aged and Orphans-25 Coral street. Pres., Jacob L. Goding; 1st Vice-Pres., Joseph Friedman; 2d Vice-Pres., Samuel Grace; 3d Vice-Pres., Mrs. Harry Rosenberg; Treas., Louis Fielding; Sec., Wilfred B. Feiga.",,
Worcester,1929,10188759,17,Journeymen Barbers' Union,Labor Organizations,,"Journeymen Barbers' Union-LOCAL UNION, NO. 186-Fin. Sec. and Treas., Ernest H. Tosi. Meets first and third Thursday of each month at 62 Madison street.",,
Worcester,1929,10188759,18,Junior Order of United American Mechanics,Civic Organizations,,"Junior Order of United American Mechanics. INDUSTRY COUNCIL, No. 17-Org. 1889. Councillor, Robert S. Adams, Jr.; Rec. Sec., Azel E. White; Fin. Sec., A. E. Sanders, Jr.; Treas., Ephraim Currier. Meets first and third Friday of each month at 12 Austin street. Officers elected semi-annually in June and December.",,
Worcester,1929,10188759,19,JUNIOR SOCIAL CIRCLE,Youth Organizations,,"JUNIOR SOCIAL CIRCLE-Pres., Mrs. Carrie Gilman; Sec., Charles E. Hargreaves; Treas., Mrs. Louise Coops. Meets third Friday of each month at Austin cor. High st.",,
Worcester,1929,10188759,20,"Kiltie Pipe Band of Worcester, Mass",Civic Organizations,,"Kiltie Pipe Band of Worcester, Mass. The- Pres., Robert M. Cape; Vice-Pres., Andrew Heben-ton; Mgr., James Falconer, 43 Upsala street; Pipe Major, Thomas Denholm. Meets at 218 Franklin.",,
Worcester,1929,10188759,21,Kiwanis Club,Civic Organizations,,"Kiwanis Club-Org. 1916. Pres., George C. Cobb; Vice Pres., George D. Robertson; Sec. and Treas., Wm. C. Radcliffe. Luncheon every Friday at 12.15 at the Bancroft Hotel. Election of officers annually in December.",,
Worcester,1929,10188759,22,Knights of Columbus,Benevolent and Fraternal,,"Knights of Columbus--ALHAMBRA COUNCIL. No. 88-Inst. 1894. Grand Knight, Frank A, Champagne; Deputy Grand Knight, Joseph K. McKeon; Treas., William F. Butler; Fin. Sec., Harry J. Kirby; Rec. Sec., Joseph E. Callahan, Jr. Meets second and fourth Tuesday at 10 Elm st. Annual election of officer in September.",,
Worcester,1929,10188759,24,DAMASCUS LODGE,Benevolent and Fraternal,,"DAMASCUS LODGE, No. 50-Inst. 1871. С. С., Harry I. Shapiro; K. of R. and S., Mark N. Jackson; M. of F., Fred S. Gray. Meets first and third Tuesday of each month in Pythian Hall, 69 Mechanic street. Officers elected in June.",,
Worcester,1929,10188759,25,REGULUS LODGE,Benevolent and Fraternal,,"REGULUS LODGE, NO. 71-C. C., Arthur A. Pond; M. of F., Joseph Baldwin; K. of R. and S., L. H. Fairbank. Meets second and fourth Wednesday of each month in K. of P. Hall, 69 Mechanic street. Officers elected in June.",,
Worcester,1929,10188759,26,WORCESTER LODGE,Benevolent and Fraternal,,"WORCESTER LODGE, NO. 105-Inst. 1903. С. С., Everett E. Clark; K. of R. and S., Ronald O. Fountain; M. of F., J. Lincoln Bailey, Meets first and third Wednesday at 69 Mechanic street. Officers elected in June.",,
Worcester,1929,10188759,27,FREEDOM LODGE,Benevolent and Fraternal,,"FREEDOM LODGE, NO. 121-Inst. 1895. С. С., William S. Langille; K. of R. and S., I. George Keyes; M. of F., Percy Milner; M. of E., Walter R. MacDonald. Meets every Thursday in K. of P. Hall, 69 Mechanic street. Officers elected in December.",,
Worcester,1929,10188759,28,RATHBONE LODGE,Benevolent and Fraternal,,"RATHBONE LODGE, NO. 171-Inst. 1909. С. С., George Wyatt; K. of R. and S., Eugene D. Kidder. M. of F., Geo. H. Little; M. of E., Frederick Barrett. Meets first and third Monday at K. of P. Hall, 69 Mechanic street. Officers elected in December.",,
Worcester,1929,10188759,29,"SECTION 3810, INSURANCE DEPT.",Secret Societies,,"SECTION 3810, INSURANCE DEPT. Org. 1878. Pres., Jacob Savatsky; Vice-Pres., M. N. Jackson; Sec., Fred S. Gray. Meetings held at 69 Mechanic street. Officers elected in December.",,
Worcester,1929,10188759,30,"BAY STATE COMPANY, No. 3, U. R.",Secret Societies,,"BAY STATE COMPANY, No. 3, U. R.-Capt., Jacob Savatsky; First Lieut., Harry Lynn; Second Lieut., David Katzeff; Recorder, Frederick Gee; Treas., Fred W. Ellsworth. Meets first and third Friday of each month at 69 Mechanic street. Annual election of officers in December.",,
Worcester,1929,10188759,31,"WORCESTER COMPANY, No. 7, U. R.",Secret Societies,,"WORCESTER COMPANY, No. 7, U. R.-Capt.; Homer J. Whiting; Recorder, Alonzo Hasty; Acting Treas., Joseph LaFlamme; Meets first and third Friday at 69 Mechanic street.",,
Worcester,1929,10188759,33,PYTHIAN SISTERS-ALPHA TEMPLE,Benevolent and Fraternal,,"PYTHIAN SISTERS-ALPHA TEMPLE, No. 5-M. E. Chief, Mrs. Ethel Whalin; M. of F., Charlotte Holmes; M. of R. and C., Emma M. Whalin, 11 Eureka street. Meets second and fourth Friday of each month at K. of P. Hall, 69 Mechanic st. Officers elected in December.",,
Worcester,1929,10188759,34,WORCESTER TEMPLE,Benevolent and Fraternal,,"WORCESTER TEMPLE, No. 25-M. E. Chief, Mrs. Anna Grout; M. of F., Mrs. Sadie Reed; M. of R. and C., Mrs. Barbara L. Dodge, 5 Wildey ave. Meets first and third Friday of each month at 69 Mechanic street. Elections held in December.",,
Worcester,1929,10188759,36,COURT OF CALANTHE,Benevolent and Fraternal,,"COURT OF CALANTHE HILL CITY COURT, No. 9-W. C., Mrs. Mabel Hamilton, 27 Carroll street. W. R. of D., Mrs. Fannie Roberts, 4 Shelby place. Meetings second and fourth Tuesday of each month in Community Center, 30 Laurel street.",,
Worcester,1929,10188760,2,Ladies of the G. A. R. GENERAL CHARLES DEVENS CIRCLE,Benevolent and Fraternal,,"Ladies of the G. A. R. GENERAL CHARLES DEVENS CIRCLE, NO. 30-Pres., Mrs. Elizabeth E. Rawson; Vice-Pres., Mrs. Ella Long; Sec., Mrs. Mable I. White, Cherry Valley; Treas., Emma J. Dunn. Meets second and fourth Tuesday in G. A. R. Hall, 55 Pearl. Election of officers in December.",,
Worcester,1929,10188760,3,FATHER FITTON COURT,Benevolent and Fraternal,,"FATHER FITTON COURT-C. R., Mrs. Catherine Flynn; Fin. Sec., Mrs. Catherine McManus; Treas., Mrs. Mary A. Morse; Rec. Sec., Bernard J. Mc Manus. Meets fourth Tuesday of each month at 112 Front street.",,
Worcester,1929,10188760,4,Ladies' Catholic Benevolent Association,Benevolent and Fraternal,,Ladies' Catholic Benevolent Association.,,
Worcester,1929,10188760,5,BLESSED SACRAMENT BRANCH,Benevolent and Fraternal,,"BLESSED SACRAMENT BRANCH-Pres., Mrs. Nellie Lubesky; Fin. Sec., Mrs. Anna L. Finneran; Treas., Mrs. Jane S. Cunningham; Rec. Sec., Mrs. Mary Conlon.",,
Worcester,1929,10188760,6,ST.CECILE BRANCH,Benevolent and Fraternal,,"ST.CECILE BRANCH-Pres., Emma Rochon; Rec., Rose A. Bissonnette; Fin. Sec., Mrs. Claude Millet; Treas., Ida Mineau.",,
Worcester,1929,10188760,7,ST. PAUL'S BRANCH,Benevolent and Fraternal,,"ST. PAUL'S BRANCH Pres., Mrs. Margaret Carrigan; Rec., Mary E. Corcoran; Fin. Sec., Mrs. Elizabeth Hurley; Treas., Mary F. Timon. Officers elected in January.",,
Worcester,1929,10188760,8,Lake View Improvement Society,Civic Organizations,,"Lake View Improvement Society-Org. 1910. Pres., Walter S. Chase; Sec., Charles E. Hitchcock, 37 Coburn av.; Treas., Charles Michelson, 41 Agate av. Regular meetings third Monday of each month. Annual meeting for election of officers in March.",,
Worcester,1929,10188760,9,La Societe l'Assomption,Benevolent and Fraternal,,"La Societe l'Assomption--SUCCURSALE NOTRE DAME, NO. 48-Pres., Amédée Gosselin; Sec., Ephrem Gosselin; Treas., Charles Gosselin. Meets second Sunday of each month at 306 Main street.",,
Worcester,1929,10188760,10,Levana Club,Clubs,,"Levana Club-Org. 1905. Club rooms, Sawyer Bldg., 393 Main street. Pres., Ruth M. Brigham; Vice-Prests., Nellie J. Bryant and Swea Boson; Cor. Sec., A. Louise Nield; Sec., Ethel M. Rankin; Asst. Sec., Ruth I. Bacon; Treas., Florence Maynard; Asst. Treas., Nellie I. Truchon. Election of officers in May.",,
Worcester,1929,10188760,11,Life Underwriters' Association of Central Massachusetts,Civic Organizations,,"Life Underwriters' Association of Central Massachusetts The Org. 1899. Inc. 1915. Pres., Christopher Scaife; Vice-Pres., Harold G. Reese; Treas., James F. Ferre; Sec., Otis D. Arnold, P. O. Box 366; Exec. Com., Chairman, ex-officio, Harold G. Reese; Sec., ex-officio, Otis D. Arnold; ex-officio, Christopher Scaife, ex-officio, James F. Ferre, Chester E. Greene, Creighton P. Morton, Herbert M. Carleton, Edward L. Tucker, H. Norton Cushman, Moses I. Longtine, Frank E. Dodge. Annual meeting second Tuesday in June.",,
Worcester,1929,10188760,12,Lincoln Aid Association,Benevolent and Fraternal,,"Lincoln Aid Association-Org. 1921. Pres., Oscar Hagberg; Vice-Pres., Lars M. Berg; Sec., Nils T. Kallstrom; Treas., Elmer Person. Meets third Monday of each month at 89 Lincoln street.",,
Worcester,1929,10188760,13,Lithuanian Alliance of America,Benevolent and Fraternal,,"Lithuanian Alliance of America 29 Endicott street. Pres., Mathew K. Stalulonis; Vice-Pres., Mykolas Tamoshunas; Rec. Sec., Gabriel A. Kyba; Fin. Sec., Joseph Shaloriejus; Treas., Joseph Norvaisha.",,
Worcester,1929,10188760,14,Loyal Orange Institution,Secret Societies,,"Loyal Orange Institution-JUSTIN D. FULTON LODGE, No. 161-Master, Samuel G. Lawson; Rec. Sec., Samuel J. Lawson, 96 Grand street; Treas., Moses Gillespie, 14 Lewis street. Meets second and fourth Tuesday of each month in Knights of Honor Hall, 306 Main street.",,
Worcester,1929,10188760,15,Loyal Order of Moose,Benevolent and Fraternal,,"Loyal Order of Moose-WORCESTER LODGE, No. 608-Inst. 1911. Dictator, William J. Ryan; Vice-Dictator, John B. Bourgeois; Prelate, John F. Martin; Sec., William H. Sullivan; Treas., Alfred J. Coursey. Meets first and third Wednesday of each month at 12 Lagrange street. Election of officers in April.",,
Worcester,1929,10188760,16,Machinists' Local No. 339,Labor Organizations,,"Machinists' Local No. 339-Rec. Sec., Daniel Donovan. Meets first and third Thursday of each month at Labor Temple, 62 Madison.",,
Worcester,1929,10188760,17,Massachusetts Catholic Order of Foresters,Benevolent and Fraternal,,"Massachusetts Catholic Order of Foresters. WORCESTER COURT, No. 59-Chief Ranger, Michael O'Sullivan; Vice-Chief Ranger, John Cronin; Rec. Sec., David J. Hannigan; Fin. Sec., Thomas F. McGinnis; Treas., James J. Thompson. Meets first and third Wednesday of each month at 112 Front street.",,
Worcester,1929,10188760,21,"Massachusetts Fruit Growers' Association, Inc.",Civic Organizations,,"Massachusetts Fruit Growers' Association, Inc. -Pres., Charles H. Gould, Haydenville; Sec., W. R. Cole, Amherst; Treas., W. H. Atkins, Amherst. Annual meeting second Wednesday in January at State Armory, Worcester.",,
Worcester,1929,10188760,22,Massachusetts Society for the Prevention of Cruelty to Animals,Welfare Organizations,,"Massachusetts Society for the Prevention of Cruelty to Animals-339 Main street, room 33. Founded by George T. Angell. Inc., March, 1868. Pres., Francis H. Rowley; Counselor, Hon. Albert E. Pillsbury; Sec., Guy Richardson; Treas., Albert A. Pollard; Agent, Robert L. Dyson.",,
Worcester,1929,10188760,23,Massachusetts Society for the Prevention of Cruelty to Children,Welfare Organizations,,"Massachusetts Society for the Prevention of Cruelty to Children-WORCESTER BRANCH-29 Pearl street, rm. 515. Pres., Samuel B. Woodward; Vice-Pres., Mrs. Charles G. Washburn; Sec., Mrs. C. Grant Bowker; Treas., Alexander H. Bullock. Meets first Monday of each month. Annual meeting in January.",,
Worcester,1929,10188760,24,Master Plumbers' Association of Worcester,Civic Organizations,,"Master Plumbers' Association of Worcester, Mass. Org. 1892. Inc. 1914. Pres., Daniel F. Loan; Vice-Pres., Henry Fox; Sec., Leo Gilligan; Treas., Carl F. Ostberg. Meets first Wednesday of each month at Levana Club, 393 Main st. Annual meeting in February.",,
Worcester,1929,10188760,25,Memorial Homes for the Blind Inc.,Benevolent and Fraternal,,"Memorial Homes for the Blind Inc. Inc. 1905. 81 Elm street and 51 Harvard street. Pres., John C. Berry; Vice-Pres., Mrs. Homer Gage; Clerk, William T. Forbes; Treas., Arthur C. Glass; Sec. of Directors, Mrs. Mary H. Fowler.",,
Worcester,1929,10188760,26,Mothers' Child Study Circle,Youth Organizations,,"Mothers' Child Study Circle-Pres., Mrs. Robert G. Trumbull; 1st Vice-Pres., Mrs. Leon Manning; Sec., Mrs. Ralph Whitney; Treas., Mrs. Clarence E. Tupper; Librarian, Mrs. W. H. Nelson. Meetings held first and third Monday of each month at homes of members. Annual election in May.",,
Worcester,1929,10188760,27,Mt.Holyoke Alumnæ Association,Youth Organizations,,"Mt.Holyoke Alumnæ Association-Pres., Mrs. Edward N. Clark; 1st Vice-Pres., Mrs. Harold Sinclair; 2d Vice-Pres., Mrs. Chester Inman; Sec., Louise Colgrove; Treas., Sarah Averill. Election of officers biennially in May.",,
Worcester,1929,10188760,28,National Association for the Advancement of Colored People,Civic Organizations,,"National Association for the Advancement of Colored People-30 Laurel street. Pres., John H. McWhorter; Vice-Pres., Mrs. Florida Gutridge; Sec., Mrs. Mabel Hamilton, 27 Carroll. Meets third Friday of each month.",,
Worcester,1929,10188760,29,National Association of Letter Carriers,Civic Organizations,,"National Association of Letter Carriers-BRANCH No. 12-Pres., William F. McGee; Vice-Pres., John J. English; Rec. Sec., William Mullaney; Fin. Sec., Hugh A. Dolan; Treas., Conrad Hakanson; Collector, Arthur L. Dee. Meets third Saturday of each month except July and August, at 306 Main street. Officers elected annually in December.",,
Worcester,1929,10188760,30,National Association of Power Engineers,Civic Organizations,,"National Association of Power Engineers-No. 32-Pres., Michael McNulty; Sec., Francis J. Meleski, 130 Endicott. Meets every Monday evening at 40 Foster street. Election of officers in June.",,
Worcester,1929,10188760,31,H. E. STONE ASSOCIATION,Civic Organizations,,"H. E. STONE ASSOCIATION, NO. 32-Pres., Thomas Kelleher; Vice-Pres., Michael McNulty; Rec. Sec., Louis J. Cormier; Cor. Sec., Francis J. Meliski; Fin. Sec., Walter B. May; Treas., Thomas H. Clark. Meets every Monday at 40 Foster street room 12. Election of officers last Monday in June.",,
Worcester,1929,10188760,32,National Fraternal Society of the Deaf,Secret Societies,,"National Fraternal Society of the Deaf-WORCESTER DIVISION-Inst. 1917-Pres., Arthur G. Clark, Whitinsville; Vice-Pres., Ben Goodstein; Sec., Delbert Trask, Auburn; Treas., George Tatro; Director, John Sandberg. Meets first Saturday evening of each month at Royal Hall, 306 Main st.",,
Worcester,1929,10188760,33,National Metal Trades Association,Civic Organizations,,"National Metal Trades Association-WORCESTER BRANCH-44 Front street. Pres., Albert C. Marble; Vice-Pres., ; Sec., Donald Tulloch; Treas., William Arter. Annual meeting and election in March.",,
Worcester,1929,10188760,34,National Woman's Trade Union League,Labor Organizations,,"National Woman's Trade Union League-WORCESTER BRANCH-Pres., Mrs. Cecelia J. Nicholson; Sec.-Treas., Mrs. William Bergen. Annual meeting in January.",,
Worcester,1929,10188761,1,WORCESTER LODGE,Secret Societies,,"WORCESTER LODGE, No. 89—Org. 1889. Warden, James M. Conger; Sec., Mrs. Julia A. A. Whiting; Fin. Sec., William A. A. Hesselton; Treas., Nellie I. Hildreth. Meets second and fourth Tuesday of each month at Fraternity Hall, 306 Main street. Election of officers in October.",,
Worcester,1929,10188761,2,WACHUSETT LODGE,Secret Societies,,"WACHUSETT LODGE, No. 341—Org. 1900. Warden, Selena Hoyle; Rec. Sec., Thomas Hoyle; 13 Douglas street; Fin. Sec., Mrs. Emma M. Elliott, 929 Millbury; Treas., Alexander M. Ryan. Meets first and third Tuesday of each month in Knights of Honor Hall, 306 Main street. Election of officers in September.",,
Worcester,1929,10188761,3,Nordstjernan,Secret Societies,,"Nordstjernan—Org. 1880. Pres., Nils Vendt; Vice-Pres., Mrs. Gust Guldberg; Fin. Sec., John V. Sohlberg; Treas., Carl E. Carlson; Sec., Fred Bjurstrom. Meets second Wednesday of each month at First Swedish Baptist Church. Annual meeting for election of officers in December.",,
Worcester,1929,10188761,4,North American Civic League for Immigrants,Civic Organizations,,"North American Civic League for Immigrants—88 Front street. Pres., D. Chauncey Brewer; Italian Sec., Mrs. Maria Belloma; Polish Sec., Josephine Kozakiewicz; Lithuanian Sec., Josephine Rudis; Greek Sec., George Maravell.",,
Worcester,1929,10188761,5,North Worcester Aid Society,Welfare Organizations,,"North Worcester Aid Society—Pres., John H. Brooks, jr.; Vice-Pres., Mrs. Georgianna Mathews; Treas., Mrs. Frank Metcalf; Sec., Miss Ida L. Brooks. Meets in North Worcester Hall or at homes of members. Annual meeting in January.",,
Worcester,1929,10188761,6,Odd Fellows Home,Secret Societies,,"Odd Fellows Home—Randolph road. Supt., William S. Barker; Matron, Mrs. Elsie M. Barker; Pres., Theodore H. Day, 14 Dale; Vice-Pres., George L. Dolloff, Winchester; Sec., George H. Fuller, Boston; Treas., Samuel K. Walker, E. Lynn; Trustees: Joseph Belcher, Randolph; John W. Roberts, Springfield; Rev. Frank G. Potter, Waltham; Frank F. Morton, W. Springfield; George L. Dolloff, Winchester; Dr. Gilbert M. Mason, Dorchester; Waldo S. Ford, Somerville; Rhotire H. Lowell, Boston; Frank E. Billings, Shrewsbury; William Walton, Watertown. Trustees meet second Wednesday of each month.",,
Worcester,1929,10188761,7,Order of Henrik Wergeland,Secret Societies,,"Order of Henrik Wergeland—Pres., John O. Wallgren; Vice-Pres., —; Fin. Sec., John Bjork; Treas., Arthur Larsen; Sec., Hilda Bernstrom. Meets first Thursday of each month at Franklin Hall, 554 Main street.",,
Worcester,1929,10188761,8,Order of Railroad Conductors—WORCESTER DIVISION,Secret Societies,,"Order of Railroad Conductors—WORCESTER DIVISION, No. 237—Sec. and Treas., James J. Butler. Meets fourth Sunday of each month in Franklin Hall, 554 Main street.",,
Worcester,1929,10188761,9,CLAN SCOTT,Secret Societies,,"Order of Scottish Clans. CLAN SCOTT, No. 85—Chief, Thomas Burton; Tanist, —; Rec. Sec., William M. Cape, jr.; 9 Bluff street; Fin. Sec., William M. Graham, jr., 12 Laurier street; Treas., William M. Cape. Meets first and third Tuesday of each month at 4 Walnut street. Election of officers in September.",,
Worcester,1929,10188761,10,CLAN SCOTT HIGHLAND DRESS ASSOCIATION,Secret Societies,,"CLAN SCOTT HIGHLAND DRESS ASSOCIATION—Pres., Robert MacDonald; Sec., Warren O. Grant, 96 Elm street; Treas., W. R. Mill. Meets first Tuesday of every month at 4 Walnut street.",,
Worcester,1929,10188761,11,THISTLE LODGE,Secret Societies,,"THISTLE LODGE, No. 2—C. D., Grace E. Cowan; Sec., Isabelle McCann; Fin. Sec., Edna Manning; Treas., Annie R. Stephenson. Meets first and third Thursday of each month at 306 Main street. Election of officers in November.",,
Worcester,1929,10188761,12,Order of Sons of Italy—LOGGIA COLOMBO MAZZINI LODGE,Secret Societies,,"Order of Sons of Italy—LOGGIA COLOMBO MAZZINI LODGE, No. 168—Venerable, Francesca Pagano; Asst. Venerable, Santo Mauro; Treas., N. Salerno; Fin. Sec., Felix Scricco. Meets first Tuesday and third Sunday of each month at 319 Shrewsbury street.",,
Worcester,1929,10188761,13,Order of the United American Men. CENTRAL COUNCIL,Secret Societies,,"Order of the United American Men. CENTRAL COUNCIL, No. 50—Org. 1892. Councillor, Leon J. Waters; Rec. Sec., George W. Cleveland; Treas., Charles C. Reed. Meets second and fourth Wednesday of each month at 12 Austin st.",,
Worcester,1929,10188761,14,SONS AND DAUGHTERS OF LIBERTY—FIDELITY COUNCIL,Secret Societies,,"SONS AND DAUGHTERS OF LIBERTY—FIDELITY COUNCIL, No. 4—Org. 1891. C., Charles W. Eames; Vice C., Victoria VanHorn; Rec. Sec., Mrs. Cora Mansfield; Treas., Arthur Coughlin. Meets first and third Monday of each month at Red Men's Wigwam, 12 Austin street. Officers elected in September.",,
Worcester,1929,10188761,15,UNITY COUNCIL,Secret Societies,,"UNITY COUNCIL, No. 30—C., Walter Sprague; Rec. Sec., Harry N. Adams; Fin. Sec., Bessie Hanson; Treas., Frank J. Winans. Meets first and third Tuesday of each month at 4 Walnut street.",,
Worcester,1929,10188761,16,Order of United Commercial Travelers—WORCESTER COUNCIL,Secret Societies,,"Order of United Commercial Travelers—WORCESTER COUNCIL, No. 136—Sen. Councelor, Herbert T. Janes; Sec. and Treas., J. Benjamin Densmore. Meets second Saturday of each month in Odd Fellows' building, 674 Main street. Election of officers in March.",,
Worcester,1929,10188761,17,Order of Vasa. RAGNAR LODGE,Secret Societies,,"Order of Vasa. RAGNAR LODGE—Org. 1898. Pres., L. Werner Olson; Vice Pres., Pehr Johnson; Rec. Sec., John Nelson; Fin. Sec., Arthur W. Goddard; Treas., Victor E. Rolander. Meets second and fourth Tuesday of each month at 89 Lincoln street. Election of officers in December.",,
Worcester,1929,10188761,18,JOHN ERICSSON LODGE,Secret Societies,,"JOHN ERICSSON LODGE, No. 25—Org. 1900. Pres., Carl D. Edgren; Vice Pres., Gustaf H. Sachs; Rec. Sec., B. L. Hedquist; Fin. Sec., Gustaf Wansulin; Treas., Carl J. Rolander. Meets first and third Wednesday of each month at 89 Lincoln st. Election of officers in December.",,
Worcester,1929,10188761,19,ENFELBREKT LODGE,Secret Societies,,"ENFELBREKT LODGE, No. 384—Org. 1897. Pres., Axel Christianson; Cor. Sec., Bror S. Flodin; Fin. Sec., Helge Rode; Treas., Charles Nord. Meets first and third Tuesday of each month at 89 Lincoln street. Officers elected in January.",,
Worcester,1929,10188761,20,FLORA LODGE,Secret Societies,,"FLORA LODGE—Org. 1899. Pres., Lydia Rode; Fin. Sec., Mrs. Emma Johnson; Rec. Sec., Lydia Nelson; Treas., Hulda Carlson. Meets first and third Thursday of each month at 89 Lincoln street",,
Worcester,1929,10188761,21,SVEABORG LODGE,Secret Societies,,"SVEABORG LODGE, No. 400—Org. 1921. Rec. Sec., Edward Persson. Meets second and fourth Thursday of each month at 89 Lincoln street. Election of officers in December.",,
Worcester,1929,10188761,22,VICTORIA LODGE,Secret Societies,,"VICTORIA LODGE—Pres., Mrs. Hildur Nelson; Vice-Pres., Jennie Lindstrom; Fin. Sec., Josephine Skantz; Rec. Sec., Mrs. Marie Anderson; Treas., Mrs. Anna Anderson. Meets first and third Wednesday of each month at 89 Lincoln street.",,
Worcester,1929,10188761,23,WORCESTER CENTRAL POMONA GRANGE,Patriotic Organizations,,"WORCESTER CENTRAL POMONA GRANGE, No. 7—Master, Sumner Chamberlain; Overseer, Sumner Chamberlain; Sec., Mrs. Irving Wood, Worcester.",,
Worcester,1929,10188761,24,WORCESTER GRANGE,Patriotic Organizations,,"WORCESTER GRANGE, No. 22—Org. 1873. Master, Frederick R. Blanchard; Overseer, Karl A. Richardson; Lecturer, Mrs. Ada Midgley; Treas., Harold A. Midgley; Sec., Mrs. M. Lizzie Wood. Meets first and third Tuesday of each month in Grand Army Hall, 55 Pearl street.",,
Worcester,1929,10188761,25,Players Club of Worcester,Clubs,,"Players Club of Worcester—Organized 1920. Pres., Thomas J. O'Connell; Vice-Pres., Mrs. George U. Ladd; Sec., D. Lester Dixon; Treas., Mary Thompson; Directors: Thomas J. O'Connell, Mrs. Maxwell Savage, Robert K. Shaw, D. Lester Dixon, Mrs. George U. Ladd",,
Worcester,1929,10188761,26,Public Education Association,Civic Organizations,,"Public Education Association—Org. 1905. Past Presidents, Samuel P. Capen, U. Waldo Cutler, William B. Aspinwall, Vincent E. Tomlinson, Charles F. Marble, Fred D. Aldrich, George F. Brooks; Pres., Dr. John E. Hildreth, George F. Brooks; Pres., Dr. John E. Rice; Vice-Prests., Alfred E. Rankin, Mrs. Chandler Bullock; Sec., Elizabeth Craighead; Asst. Sec., Mrs. L. G. Fairchild; Treas., Henry O. Tilton; Exec. Board, Dr. Lawrence A. Averill, Rev. Henry W. Hobson, Mrs. J. M. Talamo, Donald W. Campbell, Rowland J. Hastings, Harriet R. Pierce and the officers. The object of this association is to secure and maintain the highest educational standards in the city of Worcester. Annual election in May",,
Worcester,1929,10188761,27,Public School Art League,Civic Organizations,,"Public School Art League—Org. 1895. Pres., Frank J. Darrah; Vice-Pres., Edw. H. Thornhill; Sec., Ethel M. Rankin; Treas., Robert K. Shaw. The league consists of the presidents of the Worcester Art Students' Club, Chairman of the Art Department of the Woman's Club, the librarian of the Free Public Library, the supervisor of drawing and his first assistant and the superintendent of public schools, ex-officiis, a delegate from the Levana Club, two members of the school committee, by appointment of the school committee, and such other persons not exceeding ten in number, as may be elected by the league. Annual meeting in January.",,
