city,year,page,line_no,organization_name,category,sub_category,line,address,description
Worcester,1929,10188731,12,Trowbridge Memorial M. E. Church,Churches,,"Trowbridge Memorial M. E. Church, 1048 Main; founded 1860; Pastor, Edwin W. Sharp; S. S. Supt., Charles M. Hosmer.",,
Worcester,1929,10188731,13,St.Andrew's M. E. Church,Churches,,"St.Andrew's M. E. Church, 100 Chandler Street; founded 1867; Pastor, Evan M. Hurley.",,
Worcester,1929,10188731,14,First Swedish M. E. Church,Churches,,"First Swedish M. E. Church, 9 Stebbins Street; founded 1878; Pastor, Herman Young, 1922; S. S. Supt., George Lindberg.",,
Worcester,1929,10188731,15,Epworth M. E. Church,Churches,,"Epworth M. E. Church, Salisbury cor. Lancaster Street; founded 1885; Pastor, Charles E. Simpson, 1920; S. S. Supt., Gerhard Becker.",,
Worcester,1929,10188731,16,Park Avenue M. E. Church,Churches,,"Park Avenue M. E. Church, 418-420 Park Avenue, near May Street; founded 1891; Pastor, Henry G. Watling; S. S. Supt., Arthur Dowden.",,
Worcester,1929,10188731,17,Covenant M. E. Church,Churches,,"Covenant M. E. Church, 26-28 Hamilton Street, near Billings Square; founded 1913; Pastor, E. Nordin Gilbertson, 1924.",,
Worcester,1929,10188731,18,Wesley M. E. Church,Churches,,"Wesley M. E. Church, 114 Main Street cor. State; organized April 9, 1923, by union of Grace and Trinity Churches. Pastor, William S. Mitchell, D.D., 1923.  Associate Pastor, Stephen J. Callender. S. S. Supt., Leon Felton.",,
Worcester,1929,10188731,19,African M. E. Zion Church,Churches,,"African M. E. Zion Church, 62 Belmont Street; founded 1846; Pastor, Isaiah B. Turner, 19 Rodney Street, 1927; S. S. Supt., George McKenzie.",,
Worcester,1929,10188731,20,Church of the Nazarene,Churches,,"Church of the Nazarene, Day bldg; Pastor Edward E. Martin; S. S. Supt., Rupert N. Capstick.",,
Worcester,1929,10188731,21,First Presbyterian Church,Churches,,"First Presbyterian Church, Main Street, corner Hermon; founded, 1886; Pastor, Charles Allen Fisher, 1913; Asst., ; S. S. Supt., Andrew Peterson.",,
Worcester,1929,10188731,22,St. Luke's Church,Churches,,"St. Luke's Church, Pleasant Street, cor. Flagg; organized 1908; Rector, Frederick H. Danker, 1913; S. S. Supt., the Rector.",,
Worcester,1929,10188731,23,St. Michael's Episcopal Church,Churches,,"St. Michael's Episcopal Church, 340 Burncoat St., founded 1927; Rector, Robert J. Plumb, 1928; S. S. Supt., the Rector",,
Worcester,1929,10188731,24,St. John's Church,Churches,,"St. John's Church, Temple Street; founded 1846; Rector, Edward J. Fitzgerald, 1923; Assistants, Charles H. Duffy, 1919; James V. Kennedy, 1927; John A. Murphy, 1928.",,
Worcester,1929,10188731,25,St. Anne's Church,Churches,,"St. Anne's Church, Eastern Avenue; founded 1855; William C. McCaughan, 1927; Assts. Thomas A. Bolan, 1925; Michael E. Shea, 1927,",,
Worcester,1929,10188731,26,St. Paul's Church,Churches,,"St. Paul's Church, Chatham Street, cor. High; founded 1869; Rector John D. McGann, 1925; Assts., Joseph M. Ryan, James A. Nally, William V. Lucey, William F. Ahern, 1927.",,
Worcester,1929,10188731,27,St. Stephen's Church,Churches,,"St. Stephen's Church, Grafton Street, cor. Hamilton; founded 1887; Rector, John Lunney, 1923; Assts., Harry Hackett, 1926; William Mulcahey, 1925.",,
Worcester,1929,10188731,28,St. Joseph's Church,Churches,,"St. Joseph's Church (French), 34 Wall Street, cor. Thorne; founded 1891; Rector, William H. Ducharme, 1925; Assts., Hormisdas Remy, 1925; Eugene Guerin, 1927; Loyla E. Tarsien, 1928.",,
Worcester,1929,10188731,29,Church of the Holy Name of Jesus,Churches,,"Church of the Holy Name of Jesus (French), Illinois Street; founded 1893; Rector, Joseph Dalpe, 1925; Assts., Albert Beaudry, 1924; Frederic Brouillet, 1926; Albert Aubertin, 1927.",,
Worcester,1929,10188731,30,St. Casimir's Church,Churches,,"St. Casimir's Church (Lithuanian), Providence Street, corner Waverley; founded 1894; Rector, John Jakaitis; Asst., Andrew Daugis.",,
Worcester,1929,10188731,31,St. Mary's Church,Churches,,"St. Mary's Church (Polish), Richland cor. Ward; founded 1903; Rector, Boleslaw A. Bojanowski, 1913; Assts., John F. Mieczkowski, 1925; John Wieloch, 1924.",,
Worcester,1929,10188731,32,St. Anthony's Church,Churches,,"St. Anthony's Church, Kelley Square; founded 1904; Rector, Paul Hanobel, 1927; Asst., Sylvio J. Desautels, 1926.",,
Worcester,1929,10188731,33,Church of Our Lady of Mount Carmel,Churches,,"Church of Our Lady of Mount Carmel (Italian), 22 Central Street; founded 1906; Rector, Gioacchino Maffei, 1906; Asst. Andrew J. Daley, 1918.",,
Worcester,1929,10188731,34,Church of the Ascension,Churches,,"Church of the Ascension, 40 Vernon Street; founded 1911; Rector, Joseph G. Daley; Adm, Assistants, James R. McCarty, Daniel F. Daly.",,
Worcester,1929,10188731,35,Church of Our Lady of the Rosary,Churches,,"Church of Our Lady of the Rosary, Fales Street, cor. Emerson rd., Greendale; founded 1911; Rector, Richard F. Riley, 1919. Curate, Jeremiah P. Sheehan, 1927.",,
Worcester,1929,10188731,36,Church of the Blessed Sacrament,Churches,,"Church of the Blessed Sacrament, 555 Pleasant St.; founded 1912; Rector, William E. Ryan, 1912; Assts., James F. Hastings, Thomas F. Curran.",,
Worcester,1929,10188731,37,Church of Our Lady of the Angels,Churches,,"Church of Our Lady of the Angels, Main Street, cor. Montague; founded 1916; Rector, Michael J. O'Connell, 1916; Assts., James J. Donoghue, 1924; Andrew Sullivan, 1927.",,
Worcester,1929,10188731,38,Our Lady of Mercy Church,Churches,,"Our Lady of Mercy Church, 72 Mulberry Street; founded 1923; Rector, Georges Sebhlani.",,
Worcester,1929,10188731,39,Our Lady of Vilna Church,Churches,,"All Saints' Church, Irving Street, cor. Pleasant; Our Lady of Vilna Church, Highfield Road, cor. Raymond Street; founded 1843; Rector, Henry W. Hobson, 1927; Asst. Ministers, Horace W. B. Donegan, 1927; Robert J. Plumb, 1927; W. Brooke St. Bernard's Church, Lincoln Street, corner Harvard; founded 1916; Rector, George F. Flynn, 1916; Asst. Rector, Joseph F. Holland, 1927.",,
Worcester,1929,10188731,40,St. Matthew's Church,Churches,,"St. Matthew's Church, Southbridge Street, cor. Cambridge; founded 1871; Rector, William Smith; S. S. Supt., Joseph Eley. Asst., George Dacy, 1927.",,
Worcester,1929,10188731,41,St. John's Church,Churches,,"St. John's Church, 84 Lincoln Street; founded 1884; Rector, Donald N. Alexander, 1918; S. S. Supt., the Rector.",,
Worcester,1929,10188731,42,St. Mark's Church,Churches,,"St. Mark's Church, Freeland Street; founded 1888; Rector, Levi T. Miller; S. S. Supt., the Second Advent Christian Church, Chandler St. cor. Piedmont; founded 1841; Pastor, Charles O. Farnham; S. S. Supt., Frank F. Dana.",,
Worcester,1929,10188732,1,First Spiritual Church,Churches,,"First Spiritual Church, 55 Pearl Street; organized 1870; Pres., William Ostergard; Vice-Pres., Irving Haven; Treas., Mrs. Abbie Pierce; Rec. Sec., Mrs. Marjorie Ostergard; Fin. Sec., Mrs. J. Briggs",,
Worcester,1929,10188732,2,First Unitarian (Second Parish),Churches,,"First Unitarian (Second Parish), 90 Main Street, near Lincoln Sq.; founded 1785; Minister, Maxwell Savage, D.D., 1919; Parish Worker, Anna Brooks Carter",,
Worcester,1929,10188732,3,All Souls Universalist Church,Churches,,"All Souls Universalist Church, Woodland Street. corner Norwood; founded 1884; Pastor, Fenwick L. Leavitt, 1914; S. S. Supt., Mrs, A. R. Miller",,
Worcester,1929,10188732,4,First Universalist Church,Churches,,"First Universalist Church, 62 Pleasant Street; founded 1841; Pastor, Vincent E. Tomlinson, 1900; Supt., Fred R. Case",,
Worcester,1929,10188732,5,St. Mary's Assyrian Apostolic Church,Churches,,"St. Mary's Assyrian Apostolic Church, pastor Lavlais Samuel, including The Assyrian Church, Ladies' Loving Assn. and Harpoot United Assyrian Assn., 17 Hawley Street",,
Worcester,1929,10188732,6,Brethren (Plymouth),Churches,,"Brethren (Plymouth), 554 Main Street; Adrian VanderPyl, C. J. Gleason",,
Worcester,1929,10188732,7,Christian Brethren (open),Churches,,"Christian Brethren (open), 544 Main Street, room 38; James Scott, Correspondent, 31 King",,
Worcester,1929,10188732,8,Commonwealth Rescue League,Welfare Organizations,,"Commonwealth Rescue League, 1794 Chandler Street. Walter E. Stearns, Commander",,
Worcester,1929,10188732,9,Elim Svenska Pingstforsamlingen,Churches,,"Elim Svenska Pingstforsamlingen, 393 Main rm 217. Pastor August Edgren",,
Worcester,1929,10188732,10,Hellenic Orthodox Church (Saint Spyridon),Churches,,"Hellenic Orthodox Church (Saint Spyridon), 46 Orange Street; Pastor, Peter Marinaker, 56 Orange Street",,
Worcester,1929,10188732,11,International Bible Students Association,Churches,,"International Bible Students Association, 32 Franklin Street and G. A. R. building, 55 Pearl Street; Sec., Fred P. Kindred",,
Worcester,1929,10188732,12,Pentecostal Mission,Churches,,"Pentecostal Mission, 554 Main Street",,
Worcester,1929,10188732,13,St. George's Orthodox Church (Greek Catholic),Churches,,"St. George's Orthodox Church (Greek Catholic), 88 Wall Street; Pastor, Thomas N. Abodeely",,
Worcester,1929,10188732,14,St. Mary's Albanian Orthodox Church (Greek Catholic),Churches,,"St. Mary's Albanian Orthodox Church (Greek Catholic), 63 Wellington Street; Rector, Thimi Theodos",,
Worcester,1929,10188732,15,Salvation Army,Churches,,"Salvation Army-15 Elm Street; Commandant, A. Mannes Donald; Adjutant, James Campbell",,
Worcester,1929,10188732,16,Corps No. 2 (Swedish),Churches,,"Corps No. 2 (Swedish), 884 Millbury Street; Adjutant Signe Tornquist",,
Worcester,1929,10188732,17,Corps No. 3 (Swedish),Churches,,"Corps No. 3 (Swedish), 135 Belmont Street; Commandant Gustaf H. Oster",,
Worcester,1929,10188732,18,Corps No. 4 (Swedish),Churches,,"Corps No. 4 (Swedish), 47 Francis Street, Commandant, Annette Salvesen",,
Worcester,1929,10188732,19,Seventh Day Adventist Church,Churches,,"Seventh Day Adventist Church, Highland Street, cor. West; founded 1885; Pastor, Ewen D. Lamont, 1928; S. S. Supt., E. A. Lee",,
Worcester,1929,10188732,20,Swedish Pentecostal Church,Churches,,"Swedish Pentecostal Church, 16 Mechanic Rd. 217. Pastor, John A. Adrian",,
Worcester,1929,10188732,21,Swedish Seventh Day Adventist Church,Churches,,"Swedish Seventh Day Adventist Church, Highland Street, corner West; organized 1903; Pastor, Carl P. Swenson; Elder, J. P. Johnson; S. S. Supt., Carl Johnson; Treas., Axel Glandt",,
Worcester,1929,10188732,22,Syrian Antiochian Orthodox Church,Churches,,"Syrian Antiochian Orthodox Church, 34 Wall; Pastor, Michael Husson",,
Worcester,1929,10188732,23,Valley Falls Church Christian & Missionary Alliance,Churches,,"Valley Falls Church Christian & Missionary Alliance, 1411 Main Street; founded 1910; Pastor, John E. Graham",,
Worcester,1929,10188732,24,Volunteers of America,Churches,,"Volunteers of America, 12 Austin Street; Captain, F. Emil Ambrose",,
Worcester,1929,10188732,25,Worcester Metaphysical Center,Miscellaneous,,"Worcester Metaphysical Center, 217 Day bldg. and 306 Main Street; Pres., Mrs. Helen Maybury; Treas., Mrs. Margaret True. Organized 1911. Meetings Sunday, 3.30 P.M. Reading room open each day from 2.30 to 5 P.M.",,
Worcester,1929,10188732,28,City Hospital,Hospitals,,"There are nine Trustees of the City Hospital chosen by the City Council on concurrence, in January, as follows: One from the Board of Aldermen, and two from the Common Council, for one year, and six from the citizens at large for six years.",,
Worcester,1929,10188732,30,City Hospital,Hospitals,,"Commissioners of the Jaques Fund and other funds of the City Hospital-Frank A. Drury, term expires January, 1931; Francis H. Dewey, term expires 1929; John E. White, term expires 1930.",,
Worcester,1929,10188733,1,BELMONT HOSPITAL,Hospitals,,"BELMONT HOSPITAL. Belmont Street, near Adams Street. Superintendent and Resident Physician-May S. Holmes. Pathologist-Frederick H. Baker. Visiting Physician in Putnam Wards-Albert C. Getchell. Isolation wards for diphtheria and scarlet fever were opened in November, 1896, and have accommodations for the treatment of 125 patients. Putnam wards were opened in December, 1914, for the treatment of advanced tuberculosis, and accommodate fifty-five patients. The Hospital is under control of the Board of Health. Patients may be admitted on application to the Board of Health or to Dr. Holmes, Superintendent.",,
Worcester,1929,10188733,2,WORCESTER STATE HOSPITAL,Hospitals,,"WORCESTER STATE HOSPITAL. Belmont Street, opp. Shrewsbury Street. Branch, Summer Street, between East Central and Asylum. Trustees-William J. Delehanty, Edward F. Fletcher, Howard W. Cowee, John H. Perman, William J. Thayer, Mrs. Frank Dresser, Mrs. Anna C. Tatman. Treasurer and Clerk-Jessie M. D. Hamilton. Superintendent-William A. Bryan. Assistant Superintendent- Frances H. Sleeper. Assistant Physicians-Michael J. O'Meara, S. Spafford Ackerly, Clifton T. Perkins, Arthur T. Whitney, Nathan Baratt, Morris Yushis, Lyman Orton, Jacob Goldwyn. Dentist-Alfred J. Normandin. Supt. of Nurses-Ann F. McElholm. Matron-Lillian G. Carr. Steward-Herbert W. Smith. Farmer-Wallace F. Garrett. Engineer-William P. Boyd. The Worcester State Hospital, a State institution, was opened January 18, 1833. At present there are 2,223 inmates.",,
Worcester,1929,10188733,3,GRAFTON STATE HOSPITAL,Hospitals,,"GRAFTON STATE HOSPITAL. North Grafton, Mass. Trustees-Frank B. Hall, Chairman; Margaret A. Cashman, Sec.; Francis Prescott, Ernest L. Anderson, Flora M. Cangiano, Enos H. Bigelow, Winslow P. Burhoe. Superintendent-Harlan L. Paine. Asst. Supt.-Hiram L. Horsman; Assistant Physicians-James L. McAuslan, Mary Johnson, Wilbur H. Smith, John P. Powers, John P. Tierney, Anna C. Wellington. Dentist-George O. Tessier. The Grafton State Hospital, formerly known as the Worcester State Asylum, was established in accordance with an Act of the Legislature in 1877, and was opened October 23, 1877. The present number of patients is 1,552.",,
Worcester,1929,10188733,4,MEMORIAL HOSPITAL,Hospitals,,"MEMORIAL HOSPITAL. Belmont Street, near Oak Avenue. Incorporated 1871. The Hospital includes The Washburn Free Dispensary. Endowed by the late Ichabod Washburn. Dispensary established 1874. Hospital opened June 1888. Trustees-Pres., Samuel B. Woodward; Sec., Shepherd Knapp; Treas., Thomas Hovey Gage; Vice-Presidents, Homer Gage, M.D., Forrest W. Taylor, Willis E. Sibley, Waldo Lincoln, Francis H. Dewey, Reginald Washburn, Paul B. Morgan, Shepherd Knapp and Rev. A. Edward Martin, ex-officio. Staff of the Hospital: Consulting Board-Ray W. Greene, George O. Ward, Frederick H. Baker, Lemuel F. Woodward, David Harrower, Albert C. Getchell, David B. Lovell, Charles T. Estabrook, Lester C. Miller. Surgeons-Walter C. Seelye, Benjamin H. Alton, Donald S. Adams, Carleton T. Smith. Physicians-Oliver H. Stansfield, Charles A. Sparrow, Raymond W. Cutler, Erwin C. Miller. Obstetricians-George C. Lincoln, Joseph W. O'Connor, John E. Talbot, Surgeons for the Eye-William F. Holzer, John W. Cahill. Orthopedist-Charles E. Ayres. Surgeon for the Ear, Nose and Throat-Gordon Berry, Harold J. Gibby. Dermatologist-George A. Dix. Consultant in Industrial Surgery-W. Irving Clark. Neurologist-Benjamin T. Burley. Roentgenologists-Philip H. Cook, Frank W. George. Radiologist-Ernest E. Smith. Pathologist-Roger Kinnicutt. Chemical Pathologist-Oliver Stansfield. Dental Surgeon-Walter H. Richardson. Cystoscopist-O. Draper Phelps. Cardiologist-Edward J. Halloran. Orthodontist-George C. Brown. Consultant in Contagious Diseases-May S. Holmes. Superintendent Lucia L. Jaquith. Resident Surgeon-Bancroft Wheeler. Staff of the Dispensary: Surgeon and Gynecologists, Frederick R. Williams, Benjamin H. Alton, Donald S. Adams, Carleton T. Smith; Asst. Gynecologist, Winfred M. Grant; Physicians, Raymond W. Cutler, Erwin C. Miller, Edward J. Halloran; Obstetricians, Joseph W. O'Connor, George C. Lincoln, John E. Talbot; Oculists, William E. Holzer, John W. Cahill, William E. Dolan, Dermatologist, George A. Dix; Surgeons for Ear, Throat and Nose, Gordon Berry, Harold J. Gibby, F. Julius Quist, Armand L. Caron; Pathologist, Roger Kinnicutt; Chemical Pathologist, Oliver H. Stansfield; Orthopedists, Charles E. Ayres; Neurologists, Benjamin T. Burley; Roentgenologists, Phillip H. Cook, Frank W. George; Pediatric Clinic, Charles A. Sparrow; Asst., Arthur M. Kimberly, Katharine F. Woodward; Radiologist, Ernest E. Smith; Cystoscopist, O. Draper Phelps; Dentist, Lemuel W. Higgins; Social Worker, Mrs. Anna C. Strickland. Asst. Social Worker, Lillian Girard. Dispensary open daily, except Sundays and holidays",,
Worcester,1929,10188733,5,WORCESTER HAHNEMANN HOSPITAL,Hospitals,,"WORCESTER HAHNEMANN HOSPITAL. 281 Lincoln Street. Opened September, 1896. Directors-Pres., Ernest P. Bennett; Vice-Pres, E. A. Fisher, Frank H. Willard; Sec., Harry Harrison; Treas., George A. Slocomb; Edgar A. Fisher, George A. Bigelow, Elbert A. Jones, Albert E. Cross, Ernest P. Bennett, Franklin B. Durfee, Chas. G. Hill, George F. Brooks, Edwin R. Leib, John E. Willis, E. B. Miles, Myron F. Converse, Edgar Reed, Frank H. Willard, Edward J. Cross, Edward A. Bigelow, Fordyce T. Blake, E. Winsor Reed, Harry Harrison, George Slocomb, Willard Swift. Surgeons, Edgar A. Fisher, Arthur W. Marsh; Jr. Surgeon, David G. Ljungberg; Assistant Surgeons Joel M. Melick, Alfred P. LaChance. Medical Staff John E. Willis, Edwin Roy Leib, Harold K. Brigham. Medical Consultants-George A. Slocomb, Elbert A. Jones",,
Worcester,1929,10188733,6,ST. VINCENT HOSPITAL,Hospitals,,"ST. VINCENT HOSPITAL. Vernon Street, near Winthrop Street. Incorporated 1898. Officers of Corporation-Pres., Rt. Rev. Thomas M. O'Leary; Vice Pres., George Crompton; Sec. and Treas., Sister Mary Leocadia. Executive Board-Rt. Rev. Thomas M. O'Leary, George Crompton, Dr. Thomas J. Barrett, John F. Tinsley, Daniel P. Callahan, Sister M. Leocadia, Thomas H. Sullivan, Mother M. Consilli, Rev. John D. McGann",,
Worcester,1929,10188734,4,FAIRLAWN HOSPITAL. INC.,Hospitals,,FAIRLAWN HOSPITAL. INC.,,
Worcester,1929,10188734,8,LOUIS PASTEUR HOSPITAL.,Hospitals,,LOUIS PASTEUR HOSPITAL.,,
Worcester,1929,10188734,12,MAPLE HALL SANITARIUM.,Hospitals,,MAPLE HALL SANITARIUM.,,
Worcester,1929,10188734,15,THE ABBOT HOME.,Benevolent and Fraternal,,THE ABBOT HOME.,,
Worcester,1929,10188734,19,HOPE CEMETERY,Churches,,"HOPE CEMETERY-Webster Street, owned by the City. Contains 145 acres. Commissioners, Richard J. Healey, term expires 1928; William Woodward, term expires 1929; Arthur T. Squires, term expires 1930; Charles A. Harrington, term expires 1931; Frederick H. Chamberlain, term expires 1932. Chosen by the City Council in concurrence in January. Chairman, William Woodward; Secretary, Richard J. Healey; Manager, Charles A. Harrington; Asst. Manager, Arthur T. Squires; Auditor, Frederick H. Chamberlain; Superintendent, Oscar F. Burbank. Number of interments in 1928, 676",,
Worcester,1929,10188734,20,NOTRE DAME DES CANADIENS CEMETERY,Churches,,"NOTRE DAME DES CANADIENS CEMETERY-Webster Street. Contains 45 acres. Founded 1885. Pres., Louis D. Grenier; Supt. of Grounds, George J. Cross. Number of interments in 1928, 525.",,
Worcester,1929,10188734,21,RURAL CEMETERY,Churches,,"RURAL CEMETERY-Grove Street. Incorporated 1838. President, George T. Dewey; Secretary, and Treasurer, Ernest Hansen; Trustees, George T. Dewey, William T. Forbes, Waldo Lincoln, Chandler Bullock, Philip N. Curtis, George Crompton, Myron F. Converse, Forrest W. Taylor; Executive Committee, George T. Dewey, Wm. T. Forbes, Waldo Lincoln; Finance Committee, George T. Dewey, Chandler Bullock, Myron F. Converse; Auditors, Charles A. Hamilton, Harry S. Myrick; Supt., Ernest Hansen. Number of interments in 1928, 58.",,
Worcester,1929,10188734,22,ST. JOHN'S CEMETERY,Churches,,"ST. JOHN'S CEMETERY-(Catholic), South Worcester. Founded 1847. Trustee and Treas. Charles H. Duffy, 260 Cambridge Street; Superintendent, William E. Curran, 92 Greenwood Street; Number of interments in 1928, 760,",,
Worcester,1929,10188755,1,Advertising Club of Worcester,Civic Organizations,,"Advertising Club of Worcester-Pres., Chester F. Edwards; Sec., Creighton P. Morton; Treas., Harry L. Gustafson.",,
Worcester,1929,10188755,2,Agnetian Club Org.,Clubs,,"Agnetian Club Org. 1917. Pres., Helen O'Brien; Vice Pres., Mary E. Rogers; Sec., Irene C. Battey; Treas., Rev Daniel Tully; Club Director, Mrs. James J. Conroy. Meets second Monday of each month at 393 Main. Annual election in November.",,
Worcester,1929,10188755,3,Alliance Francaise,Civic Organizations,,"Alliance Francaise Pres. Emile O. LaRue, Vice Pres. Dr. Philip M. Churchman; Sec., Mrs. Philip N. Curtis. Meets once a month from October to May.",,
Worcester,1929,10188755,4,Amalgamated Association of Street and Electric Railway Employees of America Div. 22,Labor Organizations,,"Amalgamated Association of Street and Electric Railway Employees of America Div. 22-Org. 1893. Pres., Ernest W. Hanson; Vice Pres., Michael A. Kane; Rec. Sec., Percy G. Dew; Fin. Sec., Peter J. Rooney; Treas., Harry H. Bailey. Meets second Tuesday of each month at Labor Temple. Officers elected in December.",,
Worcester,1929,10188755,5,American Antiquarian Society,Libraries,,"American Antiquarian Society-Org. 1812. Library building, Salisbury street corner Park av., Worcester. The Library contains nearly half a million titles. The amount of the various funds for different use is about $390,000. Library hours from 9 A.M. to 5 p.m., except Saturday P.M., and Sunday. President, Charles L. Nichols, M. D., Litt. D., Worcester; Vice-Presidents, Arthur P. Rugg, LL.D., Worcester; Clarence W. Bowen, LL.D., New York; Sec. for Foreign Correspondence George H. Blakeslee, L. H. D., Worcester; Sec. for Domestic Correspondence, Worthington C. Ford, LL.D., Cambridge; Rec. Sec., T. Hovey Gage, LL.D., Worcester; Treas., Chandler Bullock, LL.B., Worcester; all of the above being ex-officio members of the Council, and the following Councillors; Waldo Lincoln, A.B., Worcester; Francis H. Dewey, A.M., Worcester; Henry W. Cunningham, A.B., Boston; George P. Winship, A.M., Dover, Mass.; William H. Taft. LL.D., Washington, D.C.; Clarence S. Brigham, A.M., Worcester; William V. Kellen, LL.B., Boston; James B. Wilbur, Manchester, Vt.; Samuel L. Munson, Albany, N. Y. Committee of Publication, Clarence S. Brigham, A.M., Worcester; Julius H. Tuttle, Boston; John H. Edmonds, Boston; Auditors, Daniel W. Lincoln, LL.B., Worcester; Homer Gage, M.D., Worcester; Librarian, Clarence S. Brigham, A.M. Officers elected in October.",,
Worcester,1929,10188755,6,American I. O. Daughters of St. George,Benevolent and Fraternal,,"American I. O. Daughters of St. George-PRINCESS ALICE LODGE, NO. 1-Org. 1882. Pres., Nettie Brothers; Vice-Pres., Mrs. Eliza Greenwood; Fin. Sec., Mrs. Alice L. Malpass; Rec. Sec., Mrs. Lydia Boggs; Treas., Mrs. Annie Townsend. Meets first and third Wednesdays of each month at 554 Main st. Officers elected in June and December.",,
Worcester,1929,10188755,7,American Legion-WORCESTER POST 5,Patriotic Organizations,,"American Legion-WORCESTER POST 5-58 Front Brewer bldg., fourth floor; Com., Albert F. Hall; Vice Commanders, John B. Bourgeois, Ralph A. Corey; Adj., Thomas J. Travers; Finance Officer; Horace H. Bigelow; Hist., Mrs. Marcella V. Haverty; Chaplain, Rev. Harry J. Hackett; Sergeant-at-Arms, Thomas F. Cahill, Trustees, George W. Jones, Joseph M. Lynch, John J. McCarty; Graves Registration Officer, Calvin R. Waters. Meetings second and fourth Fridays at 8 P.M. Quarters open daily 11 A.M. to 11.30 P.M. Visiting Legionaires urged to make use of our quarters while in Worcester.",,
Worcester,1929,10188755,8,American Red Cross-WORCESTER COUNTY CHAPTER,Welfare Organizations,,"American Red Cross-WORCESTER COUNTY CHAPTER-540 Main street. Chairman, Kendall Emerson, M.D.; Vice-Chairman, Mrs. J. Lester Perry; Chapter Sec., William C. Radcliffe; Treas., Charles A. Barton.",,
Worcester,1929,10188755,9,Ancient Order of Hibernians,Secret Societies,,"Ancient Order of Hibernians. Building, 26 Trumbull street. DIVISION 1-Org. 1867. Pres., Timothy H. Sullivan; Vice-Pres., Ulick Clifford; Fin. Sec., John J. Reardon; Rec. Sec., Daniel J. Clifford; Treas., Cornelius Clifford. Meets second Sunday of each month. Officers elected in October.",,
Worcester,1929,10188755,17,BUILDING CORPORATION,Uncategorized,,"BUILDING CORPORATION-Pres., James P. Coffey; Clerk, Florence J. Donoghue; Treas., William H. Larkin. Meets third Tuesday of each month.",,
Worcester,1929,10188755,18,"LADIES' AUXILIARY, DIVISION 11",Benevolent and Fraternal,,"LADIES' AUXILIARY, DIVISION 11-Pres., Mrs. Mary E. Lamberton. Vice-Pres., Mrs. Catherine Reynolds; Rec. Sec., Minnie Mara; Fin. Sec., Mrs. Sadie H. Dean. Meets second Monday of each month.",,
Worcester,1929,10188755,19,"Ancient Order of United Workmen. WORCESTER LODGE, NO. 56",Benevolent and Fraternal,,"Ancient Order of United Workmen. WORCESTER LODGE, NO. 56-Org. 1885. M. W., Philip Duvarney; Recorder, A. H. Brule; Financier, Walter Bridge; Treas., George Bergin. Meets second and fourth Wednesday of each month in K. P. Hall, 69 Mechanic street. Election of officers in September.",,
Worcester,1929,10188755,20,"Ancient and Illustrious Order of Knights of Malta. U. S. GRANT COMMANDERY, No. 150",Secret Societies,,"Ancient and Illustrious Order of Knights of Malta. U. S. GRANT COMMANDERY, No. 150-Org. 1894. Commander, Samuel Crompton; Rec., Harry C. Jenkins; Treas., Albert Curtis. Meets first and third Friday of each month at 306 Main street. Election of officers third Friday in February.",,
Worcester,1929,10188755,21,"GUSTAVUS ADOLPHUS COMMANDERY, No. 439",Secret Societies,,"GUSTAVUS ADOLPHUS COMMANDERY, No. 439-Commander, Martin B. Olson; Rec., John W. Mallquist; Treas., Arthur W. Lindberg. Meets first and third Monday of each month in Malta Hall, 306 Main street. Officers elected in February.",,
